id,title
pebYmkoHCrY,Kevin Trudeau Claims He Knows the Secret of December 21st 2012
xczGE6xulVs,Mitt Romney Wants to Ban TAMPONS
vt-eZy9V7Ig,You Might Need a Tin Foil Hat After All
r_ZRykJYlto,GPS Tracking Devices in Candy Bars
Am0_ssbnl9A,The Chiropractic Conspiracy by the American Medical Association Exposed
XpYDXvk7434,Seven companies caught spying on people in their bedrooms using webcams in laptops over WiFi
9nZIkh8CHlE,Council on Foreign Relations Tax Returns show 438 MILLION DOLLARS in assets!!
UtrzlX4Fw6U,Psychotronic Weapon Detector at Bohemian Grove protest
T3ss30ym2Vs,Bohemian Grove workers talk about working in the Grove
-NF4_olxOjg,Peter Phillips Interview at Occupy Bohemian Grove
yRLqAR09NjU,Bohemian Grove Security Watching Through the Trees
wGEnUx8dZ2Q,Cindy Sheehan at Occupy Bohemian Grove 2012 Protest
0NufO-RICpE,K-9 Unit at the Bohemian Grove to sniff out protesters if they try to sneak in
5NeqTdS5nxc,Former worker of Bohemian Grove speaks out about the club and its members
Ctu6PYRbcU8,The Road to the Bohemian Grove
x9kbreQgxPQ,Outside the Gates of Bohemian Grove
Lq9aLOq3I2g,Bill O'Reilly: Do you have to pay to use Facebook?
bALVi_9rz7I,Mark Dice Riding a Police Horse Outside the White House in Washington D.C.
do-i5TpmO60,Jim Tucker's Protégé Mark Anderson from American Free Press on Bilderberg 2012
kjWvbj8bhIc,"""Cash for Gold"" stores pay in CHECKS only NO CASH!"
gdyGAEKscGg,Jason Bermas approached by possible agent provocateur at Bilderberfest
hWr7vgHeXXM,Luke Rudkowski's Livestreaming equipment at Bilderberg 2012
prYJEAfj3h4,Mark Dice Detained by Police at Bilderberg for Videotaping Parking Lot
g-LT0sYv7iE,Jim Tucker Speaks at Bilderberg Protest 2012
AWdq6b4sRa8,Security Crawling Everywhere at Bilderberg Hotel
3E7ej0TaBwQ,Bilderberg Bodyguard Interviewed at Bilderberg 2012 by Mark Dice
6Bhrnjc-FHs,"Rain or shine, we'll expose Bilderberg crime"
cuS4S-9YHAU,"Bilderberg 2012, inside the belly of the beast."
PqSEwbOUvEA,"A Look inside Bilderberg 2012, Washington Dulles Marriott, Chantilly, CA 05-30-2012"
ndshbH3qZ6Y,"Selling 1 Oz Gold Coin for $25 (when it's worth over $1,500)"
-VwM_xSpj_o,New TV's have facial recognition and voice identification built in
L4dy7mmu2Ro,Zombie Americans Don't Know What Memorial Day is For!!!
SfH1KZyDt2E,Bilderberg Survey: 1 out of 33 people have heard of Bilderberg Group or 3.33%
m-eqG73XKns,"Ring of Fire Solar Eclipse - May 20th 2012 San Diego, CA"
63vfyN5e8lI,Bilderberg Group Busted in 1957!
PcTYlQuvvME,Bilderberg Group Launches a Website!
3TxO93WVACU,Recall the Governor for not liking Mexican food?
7ByRohrW8qg,Ron Paul banners over freeway in San Diego
_HZp0by71gY,Alec Baldwin's Credit Card Commercial Mark Dice Remix
I29pzj2e14E,Jimmy Fallon's Credit Card Commercial Mark Dice Remix
9H-hoGulwFg,Company uses facial recognition to determine if employees are smiling enough at work
gg4tq2-NxmY,Facial Recognition Systems Going Mainstream
MkGP7s0SGtY,Zombie Americans have forgotten why 4th of July is a holiday!!!
PuxKO71_v-M,Wireless microphone listens to Subway sandwich employees
lJvPsVaY49U,We did it!  Mainstream coverage of Bilderberg 2011
zkUNpo90MIM,Big Brother is Watching the Cardiff Kook
Ef0VG1WEP10,Buying a 99¢ Taco with 1 Ounce Gold Coin (worth over $1000) - from Taco Bell's Drive-Through
o19jJry1_hk,A Chiropractic Miracle
aaqaImebd1M,Americans don't know why we celebrate 4th of July
LIvea_QWF4g,"People sign ""I am a moron"" petition without reading headline"
6Ba5ZgBZOwM,GPS tracker with Microphone for Children
fX8khBJaHCo,Mailing my garbage to Glenn Beck
k0XCllEpl08,behind the scenes of my tv interview in Los Angeles
9hTbRqZcnjQ,The Super Bowl has been CANCELED!!
tznR4wPeS4M,Americans sign petition to repeal the First Amendment
IIoCfpMwjrM,Free life insurance for everyone paid for by tax dollars
h48Uff3XD0s,Walmart Shopper thinks Dow Jones average is 5 FEET
vJtS9CuyuaU,"People sign petition to ""increase inflation to 100%"" to cause hyperinflation."
WAaVK5AkZzI,Mark Dice offers over $1000 worth of gold for free to random people
heX8vKRgGUY,Mark Dice tries to sell $1100 one ounce gold coin for $50; no takers
