id,title
5WLpAk-B8R8,Goodbye YouTube?
Hmk8WM79ZEI,They're Coming for Christmas!
SnukLOqmlZk,Brian Stelter Doesn't Think It's Funny
oGoXq2OsUYs,Something Doesn't Smell Right
5rHZkjDi2Is,There's No One Like Her!
GXmVUY7sP9w,An Urgent Message from President Trump - The Media Won't Air
APh5Lwu-p3E,I Messed Up
Mn2svZNUMgE,BUSTED!
NwxPARAJ9Ic,The Saddest Part
KNmuCAfWqqo,🚨  It's Coming 🚨
Kb_piWSCyS8,I REFUSE!
-4ytpqVeB58,Homer Simpson Tried To Warn Us!
_N_BWuI0MG8,They Never Thought We Would Do It
r5L9cI1wTSA,Democrats Aren't Happy About It 😂
XxI0sNz3Pig,Brian Stelter Can't Believe It 😂
JPTAlflyPlw,Thanksgiving CANCELLED? 🦃
5MkWO0lhgn4,It May Be a While!
AyaJUGVJCpM,"Et tu, Fox News?"
PBavFBHh0jc,It Hasn't Stopped!
eRgPxxO06Mk,"""Everything is Fine"" 🤡"
YcqSTOnLo64,HOW TRUMP CAN WIN!
LyYTU10fXZ8,They Saved the Best for Last 😂
jxkk-GPQBsE,We Have To Stop This!
iiEag3pKqSE,Amazon Banned My New Book!
-HD-WKEKgHA,The October Surprise?
BD7En6LSyC0,Meet Twitter CEO Jack Dorsey
gU0BlqFsuvg,SEVEN DAYS!
2dsRvZQ9AlE,"They Call THIS ""Entertainment""?"
AWLxZoyoHRI,How Did We Get Here?
lLF8EANHzdc,Trump Strikes Back! 📡
7-WHd3rN-vw,"Time to Wake Up, Joe!  😂"
eB3-FB8LQlc,Why They’re Trying To Silence Us
GAG3WRcqk14,The “Russian Bots” Are Back!  😆
OI6jehYYA4E,It's Getting Serious
Czi3nah9taI,Now Everybody Knows!
aHUv6uWDLV0,It Has a Name
APfzDurApxg,He's Baaack!
sP1icAVeOm8,Hollywood's Biggest Secrets Revealed
ah1LBT4Hhq8,"Donald Trump Disavows Racists, the KKK, and David Duke, Over & Over While Media Claims Opposite"
8OyF2zjCK0k,Cool As Ice 🧊
eXbUh_Pl8aA,He's Back!
CDtoE51py4k,It's Time! ⏰
4Z_hkP1ZF-g,Surprise!  😂
DfC9V4eE-oA,They're Not Getting Over It 😂
rClMcfYe0Ls,Debate of the Century!
dQZJliU5CuU,The Comedic Genius of CNN 😂
KhBx3jHkm5I,Carpe Donktum's Lawyer
7hoN7ca1VVM,The Party Continues! 🤡
NqdSGKn8uxQ,The Circus is Back in Town 😂
dDd06DwrvMU,It's Not All Fun and Games!
s_QtBx1KOAQ,We Should Have Known!
DWRB2kNodKk,He's Not Very Happy About It! 😂
rBWbSU2vDvc,Old Joe BUSTED!
P1zEAF2kMOY,IT DOESN'T EVEN MATTER!
ggiprElb0JA,Candace Owens vs Cardi B 😂
Xa_Jsag42ng,The Genius of Alexandria Ocasio-Cortez 😂
E99AQhoLP1s,Nobody Could Have Imagined
Tj-WjV2dtmI,⚠️  No Truth Allowed ⚠️
0oQlnihfxhU,The Truth About Kyle Rittenhouse
JskG3G-jYOc,They're Not Taking It Very Well 😂
lKrraHPBBhw,The Fun Continues!
pGzPYetdozc,Now It's Our Turn!
xTNrOoZ34NA,Liberals Latest DUMB Idea 😆
CljBrHVPpUI,"Finally, It's Over!"
khPO-hpjpKw,The Magic is Gone 😂
AQm2tgGjBHQ,At Least They Tried 😂
kEYxQF6_CHQ,Big Tech Are Making Their Final Moves
8zH9l-PJSj0,The Celebrities Are Here To Help 🤡
e2A1Bg12bJo,It Was Only a Matter of Time 😂
iDOTnHFplsI,The Genius of Jim Acosta 😂
84LIbiuqDHg,Ol' Joe Is Ready! 😂
zz9dffhuQvc,Can You Really Blame Them?
I1KyMby-lPE,Brian Stelter's Big Secret Is Out
G08kxa-IAss,This Week Was a Doozy
JHlufpo0ExM,Why Even Bother?
Be2VSiQB9QI,No Wonder!
jCcREmDU5NA,This Explains Everything
ltZ3bYMQeqs,Masks! 🤡
Pgo8CmP0y4M,This Isn't a Joke Either
a0Jm88R18t4,This is Not a Parody - It's Real!  😂
GxgJxef0rgM,Roger Stone Speaks!
VD16eTrhPmo,Where You Least Expect It
L8uRyiRGFW4,Facebook Insider Comes Forward
yWQtvvYWBOY,I Told You!
_pDqUqy8QqE,It's Everywhere
r4J2SZw0Fl0,I'm Sorry.
jTymmHPb9F0,NOT FUNNY!
pIbedyErUGI,The Sequel 😂
zFL8D9Cs5cc,Eric Fartwell 💨 Returns!
_9MhPZRoTT0,Black Trump Supporters Rise Up!
wiKmnTw0tAM,She Loves Dominos Pizza
URooroFyhv0,At Least They Finally Admit It
JdoBIO2z_Kk,SO SAD! 😂
DjHHSxcxIjo,It's Come to This 🤡
fFpAcChNDQo,The END of America?  Peter Schiff Gives His Forecast
aa6pmiqxe9o,Here's What's Really Going On
gzokmbSXhhg,FCC Commissioner Brendan Carr on Social Media Censorship
n_vSdXJdlBk,Trying Something Different
MteObH7yz9M,IT'S ON NOW!
vtNkEWmFFCI,What Else Did You Expect?  😆
aEmuHzsTctM,Celebrities to the Rescue! 🤡
0lGzEFMrRrI,HE'S BACK! 🤡
RxDIMpG9KO8,MSNBC TOTAL MELTDOWN!  😂
maeNikww7sM,...Now for the Bad News 😂
OBnWgZaOr0U,The Expert Has Spoken! 😂
iVNimc7FRNs,It's the Newest Trend
QQoUEFO23wg,Brian Stelter is Making Waves!
FUfbKknzFNo,Finally Some Good News for a Change!
il-1UR-Pzp0,Who Would Have Known? 😂
7wyji09rjTI,How They Do It
38oiipWwMqM,Michael Moore Admits the Truth
8W4cp2Rj-dM,This is Not Allowed
7_qIG2HA8ZM,I've Had Enough!
1myGiXn71bo,Fredo Finally Comes Out
cv4hVkyskNQ,Brian Stelter Admits What We've Known All Along
5QyrSMfZ6cY,They Walk Among Us!
E-1um1xqeEY,FREDO BUSTED!
5S7Qfwc9JRY,Obama Has Lost His Magic 😂
j_FHrSoxPtY,Trump Drives Clowns Nuts at Press Briefing
sni41zr2-SY,"Oh, Now They Say It"
lhFReeTx6F8,It's About Time!
Q3pezv975Es,They Need To Stop 🛑
MAEMt8LodsI,Jake Tapeworm 🐛 Has Questions
V-9w9ceQsdo,Celebrities Will Save Us
hIVUpx8pawI,Great Job! 😂
xIy727H96oc,Is Ol' Joe Gonna Make It?
rOhdocNexvc,WRONG AGAIN RACHEL! 😂
iJ4Qcnbs_mY,A Star is Born ⭐️
USOn60F8YGs,Funny???
3UlWH4O0x6M,Is Ol' Joe Okay?
lt34F-ayUFQ,Fredo Gets Schooled by His Brother Live on Air
a_oWmAs76zE,Oh No!
V9kPOx4IFGs,"Oh, Good!"
LuJltrLa-0o,Of Course They Are!
9I7xHK5gY3Y,Are You Ready?
3TgJRd9tF_k,"No, Joe!  No!"
ia519_9CC2U,Bye Bye Bernie! ☭
29aMuLiKhpc,It's Every Day Now!
wVVBFCx2zlU,THE END IS NEAR ⚠️
GEmkPv3x7N4,Bernie Bros Aren’t Very Happy About It
CV-QqkwOsoo,LOSER! 😂
P50Y6lmQHVs,What's Going On With Ol' Joe? 😂
PwYpYn8A-cc,We'll Know Tomorrow
E3lilIBoZbE,Reality is Sinking In 😂
uX3hIlpNQpM,MSNBC Does It Again! 🤖
ZOyYJTXMrzo,A TOTAL MESS!
ndvDaatzQ34,Everybody's Talking About It
cecXmZS8gAM,That Wasn't What Bloomberg Expected 😂
IUopQ5IwYrI,He's Heeere!
5GfbX5sJx5I,Brian Stelter Finally Admits It
Ku5FFduiRVo,I'M SERIOUS MAN!
ve6xQvwVHZs,It’s Way Too Obvious!
pUf8V8rkxjY,It's Happening!
Kv_Lpi4qnSc,Here We Go Again!
MxlGtjzHmRs,Things Aren't Going According To Plan!
mZo3eWJ83yI,Too Much Winning! 😂
5OFJaP3ouDw,IT'S OFFICIAL
8Qur-tWsYv0,They'll Never Be Happy!
2rNwSCKf2U0,It's Finally Almost Over!
b69CxV16ovY,Friendly Reminder!
X7MRvVN2qRI,Is this the Jerry Springer Show?
SFii3hD4w28,CNN Laughs It Up
HBUrd6UILik,Mystery Solved! 😂
W8fC1axKo0c,Tom Steyer Finally Gets Noticed!
zdsExSD8vs4,Ivanka Owns Jim Acosta
zJ7IUbkK3s4,This is Just the Beginning 😆
oz2F1beAaRY,MAGA Luther King Day
xbb02xAjs_U,He's a Star! ⭐️
oC29DxYmh3E,OH NO!  ANYTHING BUT THAT! 😂
7VduEAhsJnY,THE DEMOCRAT DEBATE CIRCUS HAS RETURNED 🤡
kVhE3myn-EQ,YouTube Has Done The Unthinkable
dqocrwPcAU4,Bad News for CNN 😂
m-cpDWOVZEk,Democrats' Worst Nightmare Has Come True
tSNl8ZyYkj4,They Weren't Very Happy About It!
T7jNID45T_8,It Will Probably Happen This Year
UnkD5dsQAhQ,WHAT A YEAR!
BUtTNTVx-sY,President Trump's Funniest Moments 2019
kc1-lDNBPMo,"Brian Stelter Unhinged! - Best of Mark Dice ""Little Brian"" Impressions of 2019"
THcE2mAMXBo,Best of Mark Dice Impressions
J3WX6PCeySE,I Didn't Have Any Luck This Time
0AuHCc-eWk8,What's Up With This Weather Stuff? 😆
ySA77Z5VBS4,IMPEACHMENT HAS BACKFIRED!
0o804bWdYww,I Don't Get No Respect!
OpHaRuzbNgc,THE WAR ON CHRISTMAS IS HERE!
hW_OhwdLkvc,NOT AGAIN!
XmnS1XPVmj0,Chunk Yogurt is FINISHED
3NDRXrGv_4c,They're Not Invited! 🎅🏼
fdEAGlte34Y,NOBODY EVEN CARES! - AND THEY CAN'T BELIEVE IT! 😂
cSbQhUqwEds,It's Almost Over!
Z6Pe0EY_FPg,Bernie Sanders Get BIG Endorsement
Smox-CrVC9w,SUPER JOE!
FwlwO2Z2HBk,THE CIRCUS HAS RESUMED 🤡
GaDQeQVoWBA,Bye Bye Kamala! 😂
m4fTrTufSlw,Whose Idea Was This?  😂
CDiL-eIE7_I,Brian Stelter is a Star! 😂
xGMI7qYB78w,No More Jokes Allowed?
1Q2sL83lwG8,Even on Thanksgiving? 😂
zSIxSgPC4ls,"But Wait, There's More!"
HzhQKcTwyXc,"Well, That Didn't Go As Planned 😂"
eoEmZhoiuCQ,NOT AGAIN! 😆
PNW46bH32mg,Fredo Does It Again
fCJAh7TL3Ik,Poor Ol' Joe!
gUwgKnyzFgI,"""Impeachment"" Circus Continues 🤡"
mnbS0f4dSA8,Who Farted?
cdVaQqpdcpQ,Let's Get Serious For a Moment
HtTzoYU9XCY,Do We Really Need More of This? 😂
1p61NNqAtpE,The Circus Begins! 🤡
qox53VEtffI,We Did It!
HWyBa_1fNeI,It's Time!
YQvMpIQAu0A,It's Happening!
lWBgxbHTjco,MAJOR SHAKE-UP?
lfkREIENUEo,Jr. Is On Our Side
MCq6yMndo0s,BRIAN STELTER HAS FINALLY FOUND IT
slZ90Wc902E,Let's Get Serious For a Moment
i8Xomryg6Ac,BREAKING NEWS 😂
-gfaSx9NZO0,THE JOKE'S ON JIM 🤡
FXyKxff2X_k,Bad News for Chunk Yogurt
ZJaBfkfGbcs,Message to Brian Stelter
4LkbFOVqQL0,Cory Booker Admits The Truth About Democrats
damjdkwfKnQ,Joe Biden vs. Joe Biden
plvxYQbvu98,"She's Back, and Crazier Than Ever!"
SDGYuhGWj7U,This is MY Fault?
336OcJjGOMw,Mark Zuckerberg Tries Stand-Up Comedy
s7Wpb_1Zad8,I Called It!
1QhK8NXu2Vs,THE CIRCUS RETURNS TO TOWN!
kdMuYPw4G_4,CNN Gets a Taste of Their Own Medicine
u0CdWE-TucU,I ❤️ China!
IZEq3H59vPk,They're All Commies!
iWHR_RXsCo8,Hillary Running AGAIN in 2020?
qeO_K0xzbm0,South Park Predicts The Future
S7ys0eLOYEw,Problem Solved! 😂
hj1BqpX1Xz0,Is This Our Future?
MBgzne7djFU,Elizabeth Warren Gets a Big Surprise at the Airport
AbH3pJnFgY8,No More Twitter? 😂
QBuwj_h1SH4,The Only Thing Stopping Them 😂
Reogq26-KpI,Speaking of Losers...
uBY9OtlSnX8,The Circus Continues!
HzikGVcKNe4,That's All They Got? 😂
nR7uZZ6yTo4,Anything But That! 😆
aOE6J8etu0E,Meet Their New Leader!
JOln9rK2G04,MSNBC's Climate Change Special Goes Off The Rails
KXucqnj7zQc,They're Coming for the Dictionary!
141MR06UGdQ,The Secret of Alexandria Ocasio-Cortez's Success
gSbHzm0uyLM,OWNED!
49QIR1bCbUI,No Wonder They're Moving to Mexico!
JuDjJu6Un98,This Could Only Happen in California!
19P9JdxUVPQ,THE CIRCUS IS BACK IN TOWN! 🤡
3BmOGGd-Ivw,Democrats' Latest Bright Idea 😂
bHmGnhBrS8I,Big Tech News Today! 😂
3-0ApyklFxc,They're Making It Too Easy for Me!
AkCwP59D18o,He's In Big Trouble Now
mzCrErOHRx8,This Liberal YouTuber is Very Worried About Us 😂
EKQDtgH1ZuM,I Think These People Are Serious!
gzmYkjesDUI,The Last Real Comedian On Earth?
lUF23U6OKR4,YOU WON'T BELIEVE WHAT NEW TAX THEY WANT NOW!
FahwyZpmmnI,Is the Democrats' Dream Coming True?
mmc4k_Vqf0c,This Week in Censorship
68LXVcAuOU4,MSNBC Finally Apologizes
-dgCSYnMg-g,Their Week So Far 😆
YJrcbdGEtPc,BRIAN STELTER RETURNS!
_O0HnIjSoco,The Left's Next Dumb Idea
UsgK-iPnEsg,"Rachel Maddow Scores ""Big Exclusive"" 😂"
j5aWDEmviWk,MSNBC Goes Down New Rabbit Hole 😂
AG2xvjltQHo,She Finally Comes Clean! 😂
FnVNnnuDW4I,Beto's Big Announcement 😂
MDdaFx_QNJg,He Took It Personally 😂
36aMrS2GYDU,We Got The Documents!
ZX4JKasAm4o,He Asked For It 😂
Y5_J-DXM3vE,Maybe Congress Will Listen Now
zhTxcxQ_EQU,"It Was Just a Joke, Bro!"
YYy4KJgPvYc,Senator Has Had Enough 😂
-IDqU_THrWw,Birds of the Feather...
dQfTfkFdEKw,Of Course They Did
oF_3hsd2Nbo,Now They're Not So Sure!
JzNH1Y_yI2g,Tulsi For The Win!
A15Bmn75qE4,She's on a Roll 😂
WxHo_Lj10IQ,Time for Plan B
N9R_5LBnEXk,Friendly Reminder!
uqmypLs5r9g,"I'm Being ""Investigated"""
t8a6EUkwiUk,Thank You Mueller! 😂
M6wBI9P2h40,I'm on the Edge of My Seat 😂
M-rLdAnV_5M,Bernie Comes Clean!
k32c7JWgnc0,The Moment They've Been Waiting For!
ADyteiznkbs,I Made the News!
a9L00aDp77k,Brian Is On the Case
QMb9Fea3J0I,Third Time's a Charm?
NTfY_5bTO3g,It's Starting - I Told You It Would!
s7CueoDwZsI,Jim Acosta Meets Mark Dice (Again)
0N6nsMkNJlc,I Was Invited to the White House!
yOuSG-SIm7g,Live at the Capitol
QL7GjOdJ3_Q,Clean Comedy
Vr3JdzHAOSE,The Blacks
ocjtpgPy0Xk,They Just Don't Get It 😂
-HytPwt3d0Y,Plot Twist
NSLZLM5rmwE,It's Everywhere
NcaVjwa7tk0,Like Clockwork
jV7tk3MU0FI,Something is Wrong with MSNBC 😆
mIdUmqpfa00,Jim Acosta's Dream Comes True 😂
Z4263uZT92Q,This is Not a Joke
rhOtgwYAtyQ,I Guess Not 😂
A-pUfJC3b0o,Joe Biden Stumbles in First Democratic Debate
zyifyOZ7QwQ,The Circus Came to Town 🤡
imaVCj_gZVI,Media Melts Down Over Trump Meme - AGAIN!
BTmHw07TnzE,CONFIRMED
VWcGemxB-8o,Can YouTube Be Saved?
GOAdWLcwdQo,AOC vs Reality
vKty4FvdjQg,HE SET A NEW RECORD!
Hsub7ULFE3s,The Feed Dropped!
OAiCKW_deL8,Really?
PriuBoXQHeE,Jim Acosta's Biggest Failure Yet 😂
2kSEaCxMq54,I Knew It!
PUcJmTw0LlU,What Have They Done to Father's Day!??
4oAROwnzfBc,I Guess We Were Wrong
hoFfOO-7TlQ,Eric Swalwell Being a Complete Idiot
4GUiMDy1nic,It Continues
M0byKlUshv8,"Well, Um, I Think, Maybe, Ahhh..."
gWU0tHl8L_0,MSNBC's New Expert 😆
lrla4PzOEuE,They're Coming
54gsMGlhiVI,DOCTORED?
yi2ipCGZxnI,It Happened Again
6vz88hcc9j0,What is Wrong with Cable News Today?
FZvLs0rVIJM,What Happened to Robert De Niro?
-ilIO6cAvt0,It's Official - YouTube Favors Liberal Channels
8-loPw6ml1A,This Guy is the King of Comedy?
I-rhXXChjDI,Have Fun 😂
t-YLh_LKiq8,Tim Cook's Advice to Graduates
6_aHh-t4cXE,This is Not a Joke! 😆
ryNjPAIHjnM,The Laughing Stock of America!
sImwAxdP2o4,A Glimmer of Hope for the Future?
8bEjGLcad8E,Plot Twist
lav8uWJS69Y,Facebook Co-Founder Calls Out Mark Zuckerberg
NW2ohkM_l54,SUPERSIZED NOTHING BURGER
s7UCM-ZOT4Q,This is Not a Joke
CZyXJJCVBKA,Brian's 2 Cents
kjZr69-nMvA,Party Time! 😆
65Rh8w2G6xA,What a Surprise!
VP2vke68PJw,Excuse Me
uT7GYJDUmkU,Out of Gas Already?
ncrq9heBUHs,It's Starting To Sink In
_6V-2hxwiDA,If We Don't Stop Them...
tRQoJ2bvBaY,Dinner?
wc5gfMrPaYI,Sleepy
Zgk4Wy_stbg,WHAT PLANET IS HE FROM?
2Tc232TBKRg,GO AWAY!
p7MeBOUvf4k,SHE'S THE GREATEST!
7Wi1JdWGPFI,IT'S MUELLER TIME
w8_ld2yUaLQ,Schiff for Brains: An American Hero? 😆
XX46M0rB2NQ,IT'S COMING!
Z4nSBZXXnVA,Their New Plan 😂
6BvI2WFv7Ps,They Don't Know What To Say!
8U42nvX9bD4,NOW WHAT ARE THEY GOING TO DO? 😂
gQMJ5RAfHAk,FINALLY AN APOLOGY?
hv7JmWLPdDg,Get Ready!
wQxMOuln-Rg,Moron Makes Major Announcement
ZbyIzDgLaKk,MSNBC Makes a Big Mistake 😆
1W7pRD-FkpI,The Fun Continues!
bdPLY1GeEcw,I've Got a New Fan!
tBDQvQe1XGo,And The Winner Is...
BSKgg7huKqw,CNN Not Happy with Fox News
ojeUfoe-Qek,Jimmy Fallon Finally Grows a Pair
ti7cxL9AuU0,Meet Congressman Eric Swalwell
3nB7oaYJHWo,AOC Flips Out 😂
ZM3J2YO2BuA,THEY'RE NOT STOPPING!
MsXte65s1lw,THE DELUSIONS CONTINUE 😂
tllQ6b_HEcs,They Did WHAT?
QUnA249Y3KI,Bye Bye 😂
GtFGr9MYX7E,They're Digging Themselves Even Deeper!
M_-u8sabdiM,The California Governor Is An Idiot
FdDN9tD-z_g,IT'S HERE!
WATAONdAqTk,They Call This Food?
_k3Z0jsrWV8,Head of the Class
057B8UJlwtE,EVERY DAY NOW!
6Ez6M254oJ4,We're At This Point Now?
g9N9S2Pl48s,What Is Going On Here?
PYGRbqwUXtc,Planet Earth's Last Hope 😆
Iw--EsDMwHg,Google Funding CPAC?
yg9vAz88jXI,Democrats Are Playing More Games
70oU4UR8LJU,Is It Finally Over?
SDRSaMGULEY,Jack Dorsey Finally Admits It
arwVnrSOeKg,MSNBC Is Scared 😆
UyfsB9C9uBA,BRIAN STELTER RESPONDS!
vmfUzDo9oHg,Facebook Whistle-Blower Reveals Censorship Tactics
P2x51XRsop4,TOTAL CIRCUS
IqZejbUd1bU,Why Did I Do This Again?
3y-QMMz9fLk,Why Is She Here?
NM50SZZxid0,So Sad
2ogho2nnLLk,Whoops!  That Didn't Work!
UIah_cVBxbo,No More Freedom of Religion in America?
M-LGxnPcuj8,"""This Isn't Funny"""
RtT1043W5-0,This Just In
jRX4uqnA0ag,Thank God It's Friday
dyGzpIOIniI,My Career Has Ended?
f4mhPY0CoV0,Make It Stop
yQeiaeEGaFc,I Predicted This Would Happen
i-RaPNY1HDg,Guess What I Found
ye_Ny5oZqWU,She's Truly a Genius 😆
thknvTUGYjU,Not Everyone Liked It 😆
y-_nwBf3AZE,Look What the Russian Bots Are Being Blamed for Now 😆
VLT6_TzNhvM,Kate Hudson's New Baby
zu5G41drbz8,They're Everywhere!
aFpjyurafvc,You Can Trust Them Now 😆
c_TP-3I041g,New World Record 🥇
LDuM4w-ge98,Hillary Running AGAIN in 2020?
2SMz4lQYK2o,We Can All Rest Easy Now
UGwJgNlmQM4,It’s a Great Day for Journalism 😆
CSl1YEmzCV4,We Have to Take a Stand
--3oGtllMXY,"""Family Friendly"" Content ""Offends"" Google"
Sqh9UDIPeRo,Media Heartbroken 💔 After Learning the Truth
PibiZBJUpJc,Learning from the Best
wyif5jVBKWw,Baghdad Bob Visits the Border
aoEwI91Cpr4,Jim Acosta Learns That Walls Work
s2YgNqdGdCk,Billionaire’s Big Announcement
UgTMBnZqSEM,Return of Chuck and Nancy
YiM2zUSten4,It’s Too Early for This!
I-EYQT-IikY,Trump the Comedian
XOeZrFoBR18,It's Working 😆
AR1Q4vD-Ceo,The Best of Mark Dice's Brian Stelter Impressions
qTq3qeFeGo0,FOOD APPROPRIATION!
Ac_LSSY86zI,Cancel Christmas?  That's What They Want!
PISbfNPkIVU,End Freedom of Speech Says Democrat Congressman Ted Lieu
uozZNR3tCaw,Google CEO Gets a Surprise Visitor! 😆
ZdMXhgf1prk,Breaking News 😂
TQcJ2gopvkk,Kevin Hart's Career Is Over After Crossing Hollywood Puppet Masters
zkQ1Q5Cq0Wg,This is Just the Beginning
_k7qdTbUyu0,Christmas is Coming!
Hj9JzwQIxys,Technical Difficulties
O5Yj5v8_z5M,Science Proves It
EKBFGCAC8p4,They're Heeeere
BMRmoHO8nes,He Actually Did It
Ljay3E99CG4,The Genius of Alexandria Ocasio-Cortez 😆
jcl9g3TUvcM,Let's Get Serious for a Minute
WwMQSF0di1Q,My New Book - It's Here!
b4qGtEiEh4A,In Loving Memory of Jim Acosta's Career
Nxeaz4uX73s,Bye Bye Jim Acosta 😂
iqKSB7qI6ZY,What Happened?
vMJ0OBiXP-c,Are You Ready?
fhLNYQBlJNo,Democrat's Bragging Backfires
RzSs00o0ZiY,They Actually Fell For It 😆
Y8IqmQf6Nr8,The Craziest Woman Ever on Cable News
mBpcyhleXoc,This Is Our Last Chance
-GIearn4lrg,Democrats Are Getting Scared
G0hhrcaToCo,No Memes Allowed!
v11sOi-oJ9s,Grandma Gives NBC Reporter A Reality Check
16_38stCfaU,Facebook Has Crossed The Line
GRMMVB9n3uQ,Guess Who's Back!
_CnlnDBDFeQ,Media Losing Their Minds Over Kanye Trump Meeting 😂
hQlWZ5q2_nY,VICTORY
VsxLqeStuoA,ANYTHING BUT THAT!
Mw72Y2NSp6M,Brian Stelter Schooled by Veteran Journalist Ted Koppel
PSED1t1fknk,Kavanaugh Stole My G.I. Joe When I Was Six Years Old
91szs5ZqLzg,"Chevy Chase Rips Saturday Night Live - ""Worst Humor in the World"""
lqx8DU2lzq8,This is Not a Joke
uAh43UzZxac,The Craziest Campaign Ads of 2018
3fKpveX2wdI,He Finally Admits It
2TgbMVMLGts,Nobody Even Noticed
qEkCHfrLRkc,I Can't Take It Anymore
2bEFLyzQ8PY,Guess Who!
zKCBsQLOfCk,Google Executives Discuss Trump Winning Election
jdb0XRyoiB8,Trump Blamed for Creating Hurricane!
PJomjykLsNI,CNN Finally Sees the Light?
zwuLs0mm2wY,What a Hero! 😆
Q94yFCEjJg0,He Disappeared
lP1lCmhhdq8,They Got Their New Talking Points!
UNUQgX7EdZo,They've Figured It All Out 😆
oYfC2PKftc4,I've Been Real Busy Working on Something
q8Nskx8TZ1o,Mark Zuckerberg Has a New Problem!
UUuLdK_EmAo,It's Happening to ESPN Too
7fY0grcsIIE,It's Getting Worse!
jBHMyPo8cM8,Celebrities to the Rescue!
JBcrPN9QQ08,WHAT IS HAPPENING!?
PHJc5WEPX_I,BIG Changes Coming
IZWsBy7D6bg,Whoops! That Didn't Work!
0dP09pHM5M4,It's Fake!
x5Ibf9pDmXM,They're Coming For Me Next
L57YbxS_Ym8,Twitter CEO Forced to Testify About Censoring Conservatives!
YthNriaz5RY,MSNBC Host Wants Facebook Shut Down to Stop 'Fake News'
U8e4Hh4zUyA,CNN Didn't Think It Was Funny 😆
uGTxwdOzllQ,Stephen Colbert Sees Russian Bots 🤖 Everywhere
wYZG7NR9lBI,"""Trump Derangement Syndrome"" is Real - Say Psychologists"
DW_jIr9bFHc,"CNN Found ""the Trump Tape"" 😆"
Kcpk7e_HNhQ,'Gullible' Isn't In the Dictionary 😆
Z5H8xL-eMmU,They Broke YouTube
P6WIHUtQ-XE,"MSNBC Cites Parody Twitter Account as ""New Evidence"" of Russian Plot"
MrJ3qbgGeak,Anderson Cooper's Facebook Livestream is Total Failure 😆
dxc2LJn8KCo,Stop Mentioning Facts!
LWtOubW0qWo,Jim Jordan Grills Peter Strzok
VI-JUHZhy04,This Actually Happened
VyGIxrKyamE,Trey Gowdy Grills Peter Strzok
BjhUtfpP5k8,Facebook Giving $90 Million to Mainstream Media for Livestreams
mc8JAlgLClk,They Don't Have a Clue!  😂
KkKRN5spTT8,Trey Gowdy Lays into Rod Rosenstein and FBI Director Christopher Wray
_yB7mi0kXA0,The Rumors Are True
LOxtH-6j8YU,Rachel Maddow Cries
7SiCn-FYG0E,CNN's New 'Evidence' of Collusion is a Joke 🤡
GyoTmcFJK0A,Not Father's Day Too
5AsUq0WJfrA,Bill Maher Admits What Democrats Really Want
2-ok-Gjqpgs,Whoops!  Wrong Again!
5DTzpPv32TY,Liberals Can't Take a Joke 😆
OB6s-1xzKPE,I Accept Your Challenge
Lns6ZWv8z6k,No Fun Allowed
dltK5r4GBec,The Truth About Roseanne Being Canceled
SEOayuAbXlI,He's Seen the Light?
re30eyNKMuc,What Do We Have Here?
eg-AfLME1t0,"The ""Deportation Bus"" 😆"
38dVWh53jXY,GLOBAL WARMING
3WrupYPNFkU,Not Mother's Day Too
7BffChqYEPo,Google's Creepy New Artificial Intelligence Bot
q-HeLZ-QIFk,They Solved It
g7kywh1M6SE,She's Baaack
k2yZ6RyuWjk,NBC News Admits HUGE Mistake
sxZlCzkpic0,Starbucks Has Censored Me for Mocking Them
DgehKvd25lc,Diamond and Silk Crush Congressman
GY2eAWpW4_U,Kanye West Joins Trump Train
gpeXPasXfJA,Don Lemon Gets Squeezed
2-NZPmF50MU,They Can't Be Serious
Ic4Xo3BIHzY,The Truth About James Comey Memos
NsdOMrnRsvE,"Starbucks Giving Black People Free Coffee for ""Reparations""?"
_kU7IMlvg8c,His 15 Minutes Are Up
woGAz-DOXSk,James Comey Strikes Back
9jp2Of1B-3Q,Steve Scalise Grills Mark Zuckerberg About Facebook Liberal Bias
iwvFD_A5QeQ,Ted Cruz Grills Mark Zuckerberg
6CJwwjs_-GY,Lindsey Graham Grills Mark Zuckerberg
ilndMxn-7_o,MSNBC Loses Their Minds
p2veuzTsqio,CNN's Latest Conspiracy Theory 😆
o0bpzuComgs,Roseanne Reboot Triggers CNN
zFb2rScJUn4,Maxine Waters Is At It Again
mXao1OAPdjY,Mark Zuckerberg is Scum of the Earth
19BsY3YNu6o,60 Minutes NothingBurger
EN2khdQGJf0,They Finally Found It!
trd7cupDvUI,Trump Cures Cancer (Parody)
tXSAiVBDYKc,Epic Fact Check!
I5hMeY0BFLI,This is Just Too Much!
rrXSZR2ZKic,Look At Her Now
yUAVD5BCymY,They Finally Found Proof 😆
V44fPQPjKjI,They Got Their Hopes Up...and Then...
mfwWZkCgNMs,You Won’t Believe It
unebRMHSzUw,We Have a Winner!
wqpqtlaiybg,This is Real
OSm1AvkXcTA,She's Got a New Reason Now!  😆
YdlBLc59p40,They Just Couldn’t Help It
DIVCOnIsiSg,Case Closed!
gP7appOSlUM,CNN Goes Dumpster Diving Looking for Clues 😆
DJlILDmeoGU,The Gift that Keeps on Giving 😆
uqaCRzKQmbg,Democrats All Agree with Trump’s Immigration Plan!  😆
QwJzs-099n0,Liberals New Hero!
rQ2y9_42dGk,It Finally Happened
eC5ful9KmPg,They Can't Take a Joke!
RgI7eJX5dQE,Rand Paul's Epic Speech on Government Spending Today
Ek9-nmnOCEs,The Russian Bots Are Coming! 🤖
ya_yNIIB2yY,It's Party Time!
LRpGABGQdG8,They're Not Happy About It!
jbORdV_wrAY,Thank You President Trump
Kpj5-2iKqPY,They're On To Us!
1R0H4RV10EA,He Really Did This!
hk-_1QXcgsg,Trump Addresses March For Life Rally
CvqTf0pUQps,Trump's Fake News Awards
I5Y7y1vNlIE,Healthy As a Horse 😆
dLW3TItEQ3M,Whoops!  That Didn't Work!  😆
A4fzBf7TG8Q,CNN Makes History 😆
rYFdWPlJvBY,Liberals New Plan to Stop Trump 😆
2YXDqc-4Ee4,Celebrities Save America
p_KFUULOqBY,Jake Tapper Humiliated by Stephen Miller - Cuts His Mic & Goes to Commercial
lKyshp9gAoM,CNN Turning Over a New Leaf for 2018? 😆
kplCwKkx38E,They're So Desperate!  😂
oI_k_UMkk58,Trump Broke CNN 😂
pyShPPWbj-M,It Happened Again! 😂
9SMAviS_ZIo,Sarah Huckabee - Flawless Victory in Press Briefing
sG0FOO8XOUk,CNN Proves They Are Completely Worthless
0BjylDelAac,Sarah Huckabee Sanders Owns CNN's Jim Acosta at Today's Press Briefing
KwaerD8rzFI,The Dumbest Thing Ever Said on CNN
y-XUVNTajak,"Liberal Lunatic Joy Behar Makes Complete Fool of Herself on ""The View"" 😂  Celebrates Fake News!"
lpWcSdalgdw,Media Meltdown Over Trump 'Pocahontas' Joke to Navajo Code Talkers 😂
PK4zgEEqirk,MSNBC Fakes 'Live' Thanksgiving Day After Show
UNO_ps8emmk,My New Book - It's Here!
w3pOrBrCrh8,The Establishment is Crumbling!
cgT5aa74KX4,General John Kelly Destroys Lies About Trump’s Call to Widow of Fallen Soldier
qsR2tPXyPbM,Jimmy Kimmel Admits He's a Phony Who Lies for a Living
gOOcGF72bdA,CNN Blames Pokémon Go for Hillary Losing Election!
9365nJewE1Y,My New Book! - Sneak Peek!
ZmuWXd_OIKo,Something is Very Wrong with MSNBC
ogVAUKi71H4,Trump's Plan for American Manufacturing
ZQYCtmMYcnU,CNN Finally Discovers ‘Proof’ of Russia Connection 😂
hp88VHFtFc8,The End of NFL Football?
GQ7wrdRZuJk,MSNBC Meltdown  “It Just F*cking Sucks with This Out of Control Sh!t”  😂
fwTnW6ur6qE,CNN Finally Admits the Truth
-XPiw9PC1Cc,TRUMP RETWEET CAUSES CHAOS 😆
w82YW5QQ9lc,CNN: Trump Using Child Labor 😂
NhiBZ9_t8Ko,"CNN Reporter Heckled with ""Fake News!"" Shouts by Passerbys 😂"
KsI_gR-H4JY,Flood Survivor Goes Off on CNN Scum
KB2tvmtP1po,Trump Owns Reporters Upset About Arpaio Pardon 😂
hDIQ2BjR2mQ,CNN's Hurricane Harvey Insanity Off The Charts Crazy!
WWaqudptwZ4,What Happened to CNN? 😂
sMaYWp2cF74,"CNN Host Cries Over Trump Blaming ""Both Sides"""
rddggGpl6pE,Stephen Miller Schools New York Times Reporter on Immigration
DshdVX_MlSo,Al Gore's Paranoia is Getting Worse 😂
OkXkwnNOag0,CNN's Jim Acosta HUMILIATED by White House Advisor Stephen Miller at Press Briefing
mewjBKiBk2g,Celebrities Know What's Best for Us
iZxj_po_I4A,Something is Wrong with MSNBC 😂
XFR372jg9g8,Trump Gives Update on New Healthcare Bill - May Be Last Chance to Fix Obamacare
Hhjz6SR6ADY,Conservatives Fight Back in Court Against Liberal Scum
jHkC6UJlIaY,An Important Message to All Black Americans
OcYqvtTeS4Q,Elon Musk Blocked Me on Twitter!
nDEkS251Txs,CNN App Downgraded to ONE STAR in Apple App Store - From Hilarious Negative Reviews 😂😂😂
dYjkiyJOHOU,Chevy Chase Talks About SNL Liberal Agenda
9rcwx19TDlQ,Study: Most Journalists Are Dumb as Dirt
wQ5Km19myk8,The End of CNN?
ZIWrvpPsMII,MSNBC Calls Hillary Clinton a Conspiracy Theorist
qCkSeZGMbIA,Sean Spicer: Most Reporters Just Want To Be 'YouTube Stars'
RcujVF9a9vk,Phil Donahue’s Insane New Theory Why Trump Became President
Iq1M3z8UdgU,School Photoshopped Trump Shirts Out of Yearbook
-BrQAQ9DMjI,"Russians ""Helping Trump's Twitter Account"" - Liberal Lunatics Now Saying!  😂"
zB1OxbSB4Q8,CNN Reporter Whines About Being Seated in Back Row at Trump Press Conference 😂
5VIZ3RshYEQ,James Comey: Loretta Lynch Ordered Cover-Up of Hillary Clinton Criminal Investigation
q_SNmZ0xpBA,CNN Admits Fake News About Comey Testimony - Issues Retraction
ljQLLZ-uQ6A,CNN: The Clown News Network
V_LpaThE9Rs,Hillary Clinton Coughing Her Way Through Commencement Speech 2017
YHbqg_5NfQM,Jimmy Fallon Apologizes for Being Too Nice to Trump
5YoIEp3GwNs,CNN Host Has Emotional Breakdown - Because People Don't Trust CNN Anymore
UW0IvzVIUBs,Maxine Waters Reveals Proof Trump is Russian Agent 😂
5gleewHxt7k,James Comey Admits Trump Admin Didn’t Obstruct Investigation
p_ZakaYu8QI,I Hit One Million Subscribers! - We Are Dominating Liberal Media!
