,title,date,exlink,comments,category,user,popular
346,Goodbye and Good Riddance To the 16:9 Aspect Ratio,"Thursday January 21, 2021 11:43AM",(theverge.com),232,Portables (Apple),['msmash'],red
347,"Ubuntu Now Runs On Apple Silicon, Devs Say It's 'Completely Usable'","Thursday January 21, 2021 11:03AM",(omgubuntu.co.uk),69,Ubuntu,['msmash'],red
348,Raspberry Pi Foundation Launches $4 Microcontroller With Custom Chip,"Thursday January 21, 2021 10:21AM",(techcrunch.com),145,Hardware,['msmash'],red
349,Amazon Offers Biden Help With Covid-19 Vaccine Distribution,"Thursday January 21, 2021 09:40AM",(nbcnews.com),245,Businesses,['msmash'],red
350,Apple's First Headset To Be Niche Precursor To Eventual AR Glasses,"Thursday January 21, 2021 09:00AM",(bloomberg.com),18,Apple,['msmash'],red
351,Tesla Is Hiring People To Handle Complaints People Tweet At Elon Musk,"Thursday January 21, 2021 08:00AM",(engadget.com),55,Twitter,['BeauHD'],red
352,Biden Sworn In as 46th President,"Thursday January 21, 2021 06:00AM",(nytimes.com),980,United States,['msmash'],red
353,Vertical Farms Grow Veggies On Site At Restaurants and Grocery Stores,"Thursday January 21, 2021 05:00AM",(newatlas.com),83,Science,['BeauHD'],green
354,Scientists Use Satellite Imagery To Count Elephants,"Thursday January 21, 2021 02:00AM",(interestingengineering.com),33,Communications,['BeauHD'],red
355,Treasury Nominee Yellen Is Looking To Curtail Use of Cryptocurrency,"Wednesday January 20, 2021 10:30PM",(arstechnica.com),267,Bitcoin,['BeauHD'],red
356,"China Plans Online Payment Rules That May Hit Ant, Tencent","Wednesday January 20, 2021 08:00PM",(yahoo.com),27,China,['BeauHD'],red
357,"Biden Rejoins Paris Climate Accord, Works To Overturn Trump's Climate Policies","Wednesday January 20, 2021 07:20PM",(washingtonpost.com),345,Government,['BeauHD'],red
358,"Kia Will Lead Apple Car Project Work Under Hyundai Motor, Report Says","Wednesday January 20, 2021 06:40PM",(cnet.com),68,Transportation,['BeauHD'],red
359,A Chinese Hacking Group Is Stealing Airline Passenger Details,"Wednesday January 20, 2021 06:00PM",(zdnet.com),23,Security,['BeauHD'],red
360,"In Hidden Message on White House Website, Biden Calls For Coders","Wednesday January 20, 2021 05:20PM",(reuters.com),145,United States,['msmash'],red
361,Opera Now Has a Game Engine To Go With Its Gamer-Focused Browser,"Wednesday January 20, 2021 04:40PM",(engadget.com),18,Opera,['BeauHD'],red
362,LG Considers Exiting Smartphones In 2021,"Wednesday January 20, 2021 04:00PM",(theverge.com),49,Cellphones,['BeauHD'],red
363,CentOS Is Gone -- But RHEL Is Now Free For Up To 16 Production Servers,"Wednesday January 20, 2021 03:20PM",(arstechnica.com),129,Red Hat Software,['BeauHD'],red
364,Ajit Pai is Officially Out of the FCC,"Wednesday January 20, 2021 02:10PM",(vice.com),184,United States,['msmash'],red
365,"Boeing Curbed Rocket Test Over Hydraulics Issue, NASA Says","Wednesday January 20, 2021 01:35PM",(seattletimes.com),60,Space,['msmash'],red
366,Intel Outsources Core i3 To TSMC's 5nm Process,"Wednesday January 20, 2021 01:00PM",(eenewseurope.com),77,Intel,['msmash'],red
367,Valve and Five PC Games Publishers Fined $9.4M for Illegal Geo-Blocking,"Wednesday January 20, 2021 11:01AM",(techcrunch.com),98,EU,['msmash'],red
368,Google Sidelines Second Artificial Intelligence Researcher,"Wednesday January 20, 2021 10:21AM",Empty,64,AI,['msmash'],red
369,"China Builds Massive Covid-19 Quarantine Camp For 4,000 People as Outbreak Continues","Wednesday January 20, 2021 09:41AM",(cnn.com),84,China,['msmash'],red
370,Trump Seeks To Curb Foreign Cyber Meddling on Last Day in Office,"Wednesday January 20, 2021 09:00AM",(reuters.com),76,United States,['msmash'],red
371,Walmart's E-Commerce Chief Is Leaving To Build 'a City of the Future',"Wednesday January 20, 2021 08:00AM",(vox.com),99,Businesses,['BeauHD'],red
372,Global Investments Into Clean-Energy Technology Reach Record High,"Wednesday January 20, 2021 06:30AM",(axios.com),27,Power,['BeauHD'],red
373,Reddit's Former CEO Is Now In the Forest-Planting Business,"Wednesday January 20, 2021 05:00AM",(fastcompany.com),33,Businesses,['BeauHD'],green
374,"President Trump Pardons Anthony Levandowski, Ex-Uber Engineer Sentenced To Prison For Stealing Trade Secrets From Google","Wednesday January 20, 2021 01:50AM",(whitehouse.gov),240,The Courts,['BeauHD'],red
375,"Gaming the System: How GameStop Stock Surged 1,500% In Nine Months","Tuesday January 19, 2021 10:30PM",(arstechnica.com),39,Businesses,['BeauHD'],red
376,"Penn State Engineers Are Developing An Inexpensive, Thermally-Modulated Battery For Electric Cars","Tuesday January 19, 2021 09:02PM",(psu.edu),117,Transportation,['BeauHD'],red
377,Global Sales of Electric Cars Accelerate Fast In 2020 Despite Pandemic,"Tuesday January 19, 2021 08:25PM",(theguardian.com),97,Transportation,['BeauHD'],red
378,Netflix Is Finally Adding a Streaming Roulette Feature As It Clinches 200 Million Subscribers,"Tuesday January 19, 2021 08:03PM",(gizmodo.com),32,Businesses,['BeauHD'],orange
379,"Instagram Lead Says He's Not Happy With Reels Yet, Might 'Consolidate' Video Formats","Tuesday January 19, 2021 07:45PM",(theverge.com),12,Social Networks,['BeauHD'],green
380,'Anti-Facebook' MeWe Social Network Adds 2.5 Million New Members In One Week,"Tuesday January 19, 2021 07:22PM",Empty,71,Social Networks,['BeauHD'],orange
381,Malwarebytes Said It Was Hacked By the Same Group Who Breached SolarWinds,"Tuesday January 19, 2021 07:02PM",(zdnet.com),17,Security,['BeauHD'],red
382,The English Language Wikipedia Just Had Its Billionth Edit,"Tuesday January 19, 2021 06:20PM",(vice.com),43,Wikipedia,['BeauHD'],red
383,iFixit Says Teardown of AirPods Max Made Competitors Look Like Toys,"Tuesday January 19, 2021 05:40PM",Empty,99,Apple,['msmash'],red
384,FireEye Releases Tool For Auditing Networks for Techniques Used by SolarWinds Hackers,"Tuesday January 19, 2021 05:00PM",(zdnet.com),3,Security,['msmash'],red
385,Brave Becomes First Browser To Add Native Support For the IPFS Protocol,"Tuesday January 19, 2021 04:20PM",(zdnet.com),61,IT,['msmash'],red
386,"Facebook Has No Plans To Lift Trump Ban, Report Says","Tuesday January 19, 2021 03:36PM",(nbcnews.com),297,Facebook,['msmash'],red
387,India Asks WhatsApp To Withdraw New Privacy Policy Over 'Grave Concerns',"Tuesday January 19, 2021 02:59PM",(techcrunch.com),18,Privacy,['msmash'],red
388,CDPR CEO Blames 'In-Game Streaming' For Cyberpunk's Console Problems,"Tuesday January 19, 2021 11:54AM",(arstechnica.com),114,PlayStation (Games),['msmash'],red
389,GDPR: German Laptop Retailer Fined $12.6M For Video-Monitoring Employees,"Tuesday January 19, 2021 11:32AM",(zdnet.com),100,Technology,['msmash'],red
390,Qualcomm's New Snapdragon 870 Reheats the Snapdragon 865 for 2021 Phones,"Tuesday January 19, 2021 10:33AM",(theverge.com),25,Technology,['msmash'],red
391,Microsoft Joins $2 Billion Deal With GM To Roll Out Self-Driving Cars,"Tuesday January 19, 2021 09:43AM",(axios.com),121,Microsoft,['msmash'],red
392,Turkey Slaps Ad Ban on Twitter Under New Social Media Law,"Tuesday January 19, 2021 09:00AM",(reuters.com),37,Social Networks,['msmash'],red
393,What You Should Know Before Leaking a Zoom Meeting,"Tuesday January 19, 2021 08:00AM",(theintercept.com),37,Privacy,['BeauHD'],red
394,Wine 6.0 Released,"Tuesday January 19, 2021 05:00AM",(windowscentral.com),100,Wine,['BeauHD'],red
395,"Almost a Third of Recovered COVID-19 Patients Return To Hospital In Five Months, One In Eight Die","Tuesday January 19, 2021 02:00AM",(yahoo.com),294,Medicine,['BeauHD'],red
396,"Spotify's Big Bet On Podcasts Is Failing, Citi Says","Mday January 18, 2021 10:30PM",(cnbc.com),64,Music,['BeauHD'],red
397,Capsaicin Spices Up Perovskite-Based Solar Cells To Record Efficiencies,"Mday January 18, 2021 09:10PM",(cell.com),45,Power,['BeauHD'],green
398,Tim Cook: Why I Kicked Parler Off Apple's App Store,"Mday January 18, 2021 08:30PM",(cnn.com),381,Social Networks,['BeauHD'],red
399,"Apple's iPhone 13 Could Ditch the Lightning Port, Feature Next-Gen Vapor Chamber Cooling and In-Screen Fingerprint Sensor","Mday January 18, 2021 07:50PM",(appleinsider.com),89,Iphone,['BeauHD'],red
400,"Capitol Riot Suspect Plotted To Sell Stolen Pelosi Laptop To Russian Intelligence, Authorities Say","Mday January 18, 2021 07:10PM",(nbcnews.com),160,Government,['BeauHD'],red
401,"Parler CEO Brings Back Website, Promises Service Will Follow 'Soon'","Mday January 18, 2021 06:30PM",(arstechnica.com),148,The Internet,['BeauHD'],red
402,OpenWRT Forum User Data Stolen In Weekend Data Breach,"Mday January 18, 2021 05:50PM",(bleepingcomputer.com),16,Security,['BeauHD'],red
403,Cryptocat Author Gets Insanely Fast Backing To Build P2P Tech For Social Media,"Mday January 18, 2021 05:10PM",(techcrunch.com),63,Social Networks,['BeauHD'],red
404,Smartwatches Can Help Detect COVID-19 Days Before Symptoms Appear,"Mday January 18, 2021 04:30PM",(cbsnews.com),53,Science,['msmash'],red
405,Massive Blackouts Have Hit Iran. The Government is Blaming Bitcoin Mining.,"Mday January 18, 2021 03:50PM",(washingtonpost.com),89,Bitcoin,['msmash'],red
406,Popular Podcasts App Pocket Casts Is Up For Sale: Where Did It Go Wrong?,"Mday January 18, 2021 03:10PM",(medium.com),35,Media,['msmash'],red
407,Apple Pulls the Plug on User-Found Method To Sideload iOS Apps on Mac,"Mday January 18, 2021 02:30PM",(arstechnica.com),44,Desktops (Apple),['msmash'],red
408,Behind a Secret Deal Between Google and Facebook,"Mday January 18, 2021 01:50PM",(nytimes.com),40,Google,['msmash'],red
409,Hungary Mulls Sanctions Against Social Media Giants,"Mday January 18, 2021 01:14PM",(reuters.com),43,Social Networks,['msmash'],red
410,Safari 14 Added WebExtensions Support. So Where Are the Extensions?,"Mday January 18, 2021 12:30PM",(sixcolors.com),14,Safari,['msmash'],red
411,'I Looked at All the Ways Microsoft Teams Tracks Users and My Head is Spinning',"Mday January 18, 2021 11:51AM",(zdnet.com),81,Privacy,['msmash'],red
412,Samsung Heir Lee Jae-yong Sentenced To 30 Months in Prison in Bribery Case,"Mday January 18, 2021 11:05AM",(scmp.com),16,News,['msmash'],red
413,SoftBank-Backed WhatsApp Rival Hike Goes Off the Air in India,"Mday January 18, 2021 10:28AM",(bloomberg.com),6,Social Networks,['msmash'],red
414,DuckDuckGo Surpasses 100 Million Daily Search Queries For the First Time,"Mday January 18, 2021 09:50AM",(zdnet.com),56,IT,['msmash'],red
415,GitHub Admits 'Significant Mistakes Were Made' in Firing of Jewish Employee,"Mday January 18, 2021 09:03AM",(theverge.com),270,IT,['msmash'],red
416,"Venice, Italy Plans to Watch Every Move of Its 30 Million Tourists","Mday January 18, 2021 06:34AM",(cnn.com),60,EU,['EditorDavid'],red
417,Ask Slashdot: How Should User-Generated Content Be Moderated?,"Mday January 18, 2021 03:34AM",(vortex.com),385,Social Networks,['EditorDavid'],red
418,7% of Americans Have Had Covid-19,"Sunday January 17, 2021 11:59PM",(cnn.com),263,United States,['EditorDavid'],red
419,Virgin Orbit Just Successfully Launched a 70-Foot Rocket From Its 747,"Sunday January 17, 2021 09:59PM",(cnn.com),44,Space,['EditorDavid'],red
420,Amazon Begins Removing QAnon Goods For Sale,"Sunday January 17, 2021 08:59PM",(seattletimes.com),169,Businesses,['EditorDavid'],orange
421,Twitter Temporarily Suspends Account of US Representative,"Sunday January 17, 2021 07:59PM",(cnn.com),358,Twitter,['EditorDavid'],red
422,"Report: US Halts Huawei's Suppliers, Including Intel, in Last Blow to China's 5G","Sunday January 17, 2021 06:59PM",(reuters.com),50,United States,['EditorDavid'],red
423,Florida's Whistleblower Covid-19 Data Manager Arrested Today,"Sunday January 17, 2021 05:59PM",(tampabay.com),121,The Courts,['EditorDavid'],red
424,Is There a Tech Worker 'Exodus' From the San Francisco Bay Area?,"Sunday January 17, 2021 04:35PM",(sfgate.com),158,United States,['EditorDavid'],red
425,Anti-Mask Protesters Proudly Filmed Their Confrontation With a Grocery Store's Manager,"Sunday January 17, 2021 03:34PM",(pennlive.com),304,United States,['EditorDavid'],red
426,"Darkened SpaceX Satellites Can Still Disrupt Astronomy, New Research Suggests","Sunday January 17, 2021 02:34PM",(gizmodo.com),64,Space,['EditorDavid'],red
427,Signal Back After 24 Hours of Outages Caused by Surging Traffic,"Sunday January 17, 2021 01:34PM",(androidauthority.com),36,Social Networks,['EditorDavid'],red
428,Estimated Cost of Poor Software Quality in the U.S. in 2020:  $2.1 Trillion,"Sunday January 17, 2021 12:40PM",(techrepublic.com),118,Programming,['EditorDavid'],red
429,Online Misinformation Dropped Dramatically After Twitter Banned Trump,"Sunday January 17, 2021 12:04PM",(seattletimes.com),265,Social Networks,['EditorDavid'],orange
430,Are Tech Companies Ducking Responsibility For The Need to De-Platform?,"Sunday January 17, 2021 11:34AM",(politico.com),134,Social Networks,['EditorDavid'],red
431,A 'Debilitating' Shortage of Computer Chips is Closing Auto Factories Worldwide,"Sunday January 17, 2021 10:34AM",(msn.com),152,Transportation,['EditorDavid'],red
432,Jamie Zawinski Calls Cinnamon Screensaver Lock-Bypass Bug 'Unconscionable',"Sunday January 17, 2021 06:34AM",(jwz.org),172,X,['EditorDavid'],red
433,41% of IT Leaders Believe AI Will Take Their Jobs By 2030,"Sunday January 17, 2021 03:34AM",(zdnet.com),110,AI,['EditorDavid'],red
434,How Tim Berners-Lee Will Fix the Internet,"Sunday January 17, 2021 12:34AM",(reuters.com),63,Social Networks,['EditorDavid'],red
435,"After 2 Years on Mars, NASA's Digger Declared Dead","Saturday January 16, 2021 10:45PM",(nbcnews.com),33,NASA,['EditorDavid'],orange
436,'Major Component Malfunction' Ends SLS Rocket Test Early. NASA Considers New Timeline,"Saturday January 16, 2021 09:05PM",(floridatoday.com),112,NASA,['EditorDavid'],red
437,Robert Cringley Predicted 'The Death of IT' in 2020. Was He Right?,"Saturday January 16, 2021 07:34PM",(cringely.com),54,IBM,['EditorDavid'],red
438,"Online Far-Right Movements Fracture, as 'Gullible' QAnon Supporters Criticized","Saturday January 16, 2021 06:34PM",(nbcnews.com),233,Social Networks,['EditorDavid'],red
439,Apple Suspended Social Media Platform Wimkin From Its App Store,"Saturday January 16, 2021 05:34PM",(wsj.com),77,Social Networks,['EditorDavid'],red
440,Thousands of Users Unknowingly Joined Signal Because of a 12-Year-Old's App,"Saturday January 16, 2021 03:24PM",(vice.com),41,Social Networks,['EditorDavid'],red
441,Google Employees Try Baking Recipes Created by AI,"Saturday January 16, 2021 02:15PM",(foodandwine.com),27,AI,['EditorDavid'],green
442,Superconducting Microprocessors? Turns Out They're Ultra-Efficient,"Saturday January 16, 2021 01:08PM",(ieee.org),80,Hardware,['EditorDavid'],red
443,Joe Biden Promotes 'Science Advisor' to US Cabinet-Level Position,"Saturday January 16, 2021 12:19PM",(apnews.com),146,Government,['EditorDavid'],orange
444,"US President-Elect Biden Starts New Twitter Account, Criticizes Policy on POTUS Account","Saturday January 16, 2021 11:34AM",(bloomberg.com),237,Twitter,['EditorDavid'],red
445,"EFF, Cory Doctorow Warn About the Dangers of De-Platforming and Censorship","Saturday January 16, 2021 10:34AM",(eff.org),231,Electronic Frontier Foundation,['EditorDavid'],red
446,Quixotic Californian Crusade To Officially Recognize the Hellabyte,"Saturday January 16, 2021 08:00AM",(theregister.com),128,Math,['BeauHD'],red
447,FAA Approves Fully Automated Commercial Drone Flights,"Saturday January 16, 2021 05:00AM",(go.com),52,Government,['BeauHD'],red
448,"Seagrass 'Neptune Balls' Sieve Millions of Plastic Particles From Water, Study Finds","Saturday January 16, 2021 02:00AM",Empty,23,Earth,['BeauHD'],red
449,MacOS Malware Used Run-Only AppleScripts To Avoid Detection For Five Years,"Friday January 15, 2021 10:30PM",(zdnet.com),65,Security,['BeauHD'],red
450,Facebook Uses AI To Predict If COVID-19 Patients Will Need More Care,"Friday January 15, 2021 09:02PM",(cnet.com),31,Facebook,['BeauHD'],red
451,Amazon.com and 'Big Five' Publishers Accused of eBook Price-Fixing,"Friday January 15, 2021 08:25PM",(theguardian.com),50,Books,['BeauHD'],red
452,Apple Plans First iMac Desktop Redesign In Nearly a Decade,"Friday January 15, 2021 07:45PM",(bloomberg.com),46,iMac,['BeauHD'],red
453,Xbox's 'Instant On' Feature Could Consume 4 Billion kWh By 2025,"Friday January 15, 2021 07:02PM",(arstechnica.com),104,XBox (Games),['BeauHD'],red
454,Calculations Show It'll Be Impossible To Control a Super-Intelligent AI,"Friday January 15, 2021 06:20PM",(sciencealert.com),194,AI,['BeauHD'],red
455,University of Florida Asks Students To Use App To Report Professors Who Don't Teach In Person,"Friday January 15, 2021 05:40PM",(edsurge.com),87,Software,['BeauHD'],red
456,Amazon Warehouse Workers To Decide Whether To Form Company's First US Union,"Friday January 15, 2021 05:02PM",(npr.org),57,Businesses,['BeauHD'],red
457,"Google Removing Inadvertent Ability for Chromium Browsers To Access Chrome Bookmarks, Sync","Friday January 15, 2021 04:25PM",(9to5google.com),34,Chrome,['msmash'],red
458,"Apple Fails To Overturn VirnetX Patent Verdict, Could Owe Over $1.1 Billion","Friday January 15, 2021 03:45PM",(reuters.com),55,Businesses,['msmash'],red
459,"WhatsApp Delays Enforcement of Privacy Terms by 3 Months, Following Backlash","Friday January 15, 2021 03:08PM",(techcrunch.com),34,Facebook,['msmash'],red
460,NSA Warns Against Using DoH Inside Enterprise Networks,"Friday January 15, 2021 02:25PM",(zdnet.com),61,Security,['msmash'],red
461,Apple Plans Podcasting Subscription Service in Threat To Spotify,"Friday January 15, 2021 01:45PM",(theinformation.com),20,Media,['msmash'],red
462,"Intel Has To Be Better Than 'Lifestyle Company' Apple at Making CPUs, Says New CEO","Friday January 15, 2021 01:05PM",(theverge.com),215,Intel,['msmash'],red
463,Apple Plans Upgraded MacBook Pros With Return of Magnetic Charging,"Friday January 15, 2021 12:25PM",(bloomberg.com),102,Portables (Apple),['msmash'],red
464,Ford Halts Focus Car Plant for Full Month Due To Chip Shortage,"Friday January 15, 2021 11:45AM",(bloomberg.com),61,Transportation,['msmash'],red
465,Why Cancer Cells Waste So Much Energy,"Friday January 15, 2021 11:04AM",(mit.edu),31,Science,['msmash'],red
466,"Apple Testing Vapor Chamber Thermal Tech For Next-Gen iPhone, Kuo Says","Friday January 15, 2021 10:23AM",(appleinsider.com),49,Businesses,['msmash'],red
467,US Blacklists Xiaomi in Widening Assault on China Tech,"Friday January 15, 2021 09:44AM",(bloomberg.com),63,China,['msmash'],red
468,Amazon Will Let Companies Build Voice Assistants on Alexa,"Friday January 15, 2021 09:04AM",(bloomberg.com),25,AI,['msmash'],red
469,Tech Coalition Working To Create Digital COVID-19 Vaccination Passport,"Friday January 15, 2021 08:00AM",(thehill.com),190,Medicine,['BeauHD'],red
470,Gemini Is Launching a Credit Card With Bitcoin Rewards,"Friday January 15, 2021 05:00AM",(techcrunch.com),19,Bitcoin,['BeauHD'],green
471,'Magic Mushrooms' Grow In Man's Blood After Injection With Shroom Tea,"Friday January 15, 2021 02:00AM",(livescience.com),116,Science,['BeauHD'],green
472,"2020 Was Second-Hottest Year On Record, NOAA Says","Thursday January 14, 2021 10:30PM",(nbcnews.com),105,Earth,['BeauHD'],red
473,Facial Recognition Reveals Political Party In Troubling New Research,"Thursday January 14, 2021 09:02PM",(techcrunch.com),275,AI,['BeauHD'],red
474,MIT Professor Charged With Hiding Work For China,"Thursday January 14, 2021 08:25PM",(apnews.com),83,China,['BeauHD'],red
475,Windows 10 Bug Corrupts Your Hard Drive On Seeing This File's Icon,"Thursday January 14, 2021 07:45PM",(bleepingcomputer.com),96,Data Storage,['BeauHD'],red
476,Andrew Yang Kicks Off NYC Mayoral Run With Basic Income Promise,"Thursday January 14, 2021 07:02PM",(aljazeera.com),155,The Almighty Buck,['BeauHD'],red
477,Medical Study Suggests iPhone 12 With MagSafe Can Deactivate Pacemakers,"Thursday January 14, 2021 06:20PM",Empty,33,Iphone,['BeauHD'],red
478,"Google Closes the Fitbit Acquisition, Pledges To Not Use Data For Ads","Thursday January 14, 2021 05:40PM",(arstechnica.com),59,Businesses,['BeauHD'],red
479,"Jack Dorsey Defends Twitter's Trump Ban, Then Enthuses About Bitcoin","Thursday January 14, 2021 05:02PM",(theverge.com),171,Twitter,['BeauHD'],red
480,"The Richer You are, The More Likely You'll Social Distance, Study Finds","Thursday January 14, 2021 04:24PM",(jhu.edu),101,Science,['msmash'],red
481,Is Letterboxd Becoming a Blockbuster?,"Thursday January 14, 2021 03:45PM",(nytimes.com),28,Social Networks,['msmash'],red
482,"Amazon Makes It Too Hard To Cancel Prime, Groups Tell Regulators","Thursday January 14, 2021 03:08PM",(bloomberg.com),95,Businesses,['msmash'],red
483,The Fractured Tech Lobby's Uphill Battles,"Thursday January 14, 2021 02:29PM",(axios.com),51,Businesses,['msmash'],red
484,Blue Origin Successfully Launches and Lands Key Crew Capsule Test in First Mission of 2021,"Thursday January 14, 2021 01:45PM",(techcrunch.com),60,Earth,['msmash'],red
485,Samsung Inadvertently Used iPhone To Tweet Galaxy S21 and S21+ Promo,"Thursday January 14, 2021 01:05PM",(appleinsider.com),69,Iphone,['msmash'],red
486,Windows 10X for Single Screens Leaks,"Thursday January 14, 2021 12:25PM",(thurrott.com),107,Windows,['msmash'],red
487,Amazon's Ring Neighbors App Exposed Users' Precise Locations and Home Addresses,"Thursday January 14, 2021 11:48AM",(techcrunch.com),19,Security,['msmash'],red
488,Google Reveals Sophisticated Windows and Android Hacking Operation,"Thursday January 14, 2021 11:10AM",(zdnet.com),15,Google,['msmash'],red
489,"The Galaxy S21 and S21+ Are Samsung's New, More Affordable Flagships","Thursday January 14, 2021 10:25AM",(engadget.com),77,Android,['msmash'],red
490,Poland Plans To Make Censoring of Social Media Accounts Illegal,"Thursday January 14, 2021 09:41AM",(theguardian.com),530,Social Networks,['msmash'],red
491,Apple Removes Feature That Allowed Its Apps To Bypass macOS Firewalls and VPNs,"Thursday January 14, 2021 09:02AM",(zdnet.com),29,Desktops (Apple),['msmash'],red
492,"US Asks Tesla To Recall 158,000 Vehicles For Touchscreen Failures","Thursday January 14, 2021 08:00AM",(reuters.com),137,Transportation,['BeauHD'],red
493,Qualcomm To Acquire NUVIA: A CPU Magnitude Shift,"Thursday January 14, 2021 05:00AM",(anandtech.com),25,Businesses,['BeauHD'],orange
494,EU Must 'Move At Speed' On Space Broadband Network,"Thursday January 14, 2021 02:00AM",(bbc.com),76,Communications,['BeauHD'],red
495,Google Trained a Trillion-Parameter AI Language Model,"Wednesday January 13, 2021 10:30PM",(venturebeat.com),110,AI,['BeauHD'],red
496,AT&T Kills Off the Failed TV Service Formerly Known As DirecTV Now,"Wednesday January 13, 2021 08:25PM",(arstechnica.com),54,AT&T,['BeauHD'],red
497,The Linux Foundation Now Offers a Suite of Open-Source Management Classes,"Wednesday January 13, 2021 07:45PM",(zdnet.com),7,Education,['BeauHD'],green
498,FTC Settlement With Ever Orders Data and AIs Deleted After Facial Recognition Pivot,"Wednesday January 13, 2021 07:02PM",Empty,20,AI,['BeauHD'],red
499,ECB's Christine Lagarde Blasts Bitcoin's Role In Facilitating Money Laundering,"Wednesday January 13, 2021 06:20PM",(bloomberg.com),126,Bitcoin,['BeauHD'],red
500,TikTok: All Under-16s' Accounts Made Private,"Wednesday January 13, 2021 05:40PM",(bbc.com),21,Social Networks,['BeauHD'],red
501,Pirate Bay Founder Thinks Parler's Inability To Stay Online Is 'Embarrassing',"Wednesday January 13, 2021 05:02PM",(vice.com),307,Piracy,['BeauHD'],red
502,House Votes To Impeach President Trump a Historic Second Time,"Wednesday January 13, 2021 04:35PM",(nytimes.com),557,Government,['BeauHD'],orange
503,UK Nuclear Spacecraft Could Halve Time of Journey To Mars,"Wednesday January 13, 2021 04:25PM",(theguardian.com),145,Mars,['msmash'],red
504,BeagleV is a $150 RISC-V Computer Designed To Run Linux,"Wednesday January 13, 2021 03:45PM",(arstechnica.com),52,Hardware,['msmash'],red
505,Airbnb Blocks DC Reservations Around Inauguration,"Wednesday January 13, 2021 03:25PM",(axios.com),95,United States,['BeauHD'],orange
506,"Ubisoft To Make Star Wars Game, Marking End To EA Exclusivity","Wednesday January 13, 2021 03:05PM",(bloomberg.com),31,Games,['msmash'],red
507,"Apple Invests Millions To Back Entrepreneurs of Color, Part of Racial Justice Effort","Wednesday January 13, 2021 02:25PM",(reuters.com),193,Businesses,['msmash'],red
508,Dropbox To Cut 11% of its Global Workforce,"Wednesday January 13, 2021 01:45PM",(cnbc.com),41,Businesses,['msmash'],red
509,Debian Discusses Vendoring -- Again,"Wednesday January 13, 2021 01:05PM",(lwn.net),48,Debian,['msmash'],red
510,"Signal's Brian Acton Talks About Exploding Growth, Monetization and WhatsApp Data-Sharing Outrage","Wednesday January 13, 2021 12:25PM",(techcrunch.com),42,Encryption,['msmash'],red
511,NASA Spacecraft Discovers the Universe is Less Crowded Than We Thought,"Wednesday January 13, 2021 11:45AM",(cnet.com),37,NASA,['msmash'],red
512,"Plaid Pulled Plug on Visa Deal Over Price, Not Antitrust Concerns","Wednesday January 13, 2021 11:07AM",(axios.com),7,Businesses,['msmash'],red
513,Disappointing Chinese Vaccine Results Pose Setback for Developing World,"Wednesday January 13, 2021 10:25AM",(nytimes.com),175,China,['msmash'],red
514,"Intel CEO Bob Swan To Step Down in February, VMware CEO Pat Gelsinger To Replace Him","Wednesday January 13, 2021 09:45AM",(cnbc.com),41,Intel,['msmash'],red
515,EPA Raises Barriers To Climate-Change Rules,"Wednesday January 13, 2021 09:06AM",(wsj.com),70,Earth,['msmash'],red
516,WhatsApp Clarifies It's Not Giving All Your Data To Facebook,"Wednesday January 13, 2021 08:00AM",(theverge.com),92,Encryption,['BeauHD'],red
517,Most Distant Quasar Discovered Sheds Light On How Black Holes Grow,"Wednesday January 13, 2021 05:00AM",(phys.org),11,Space,['BeauHD'],red
