,title,date,exlink,comments,category,user,popular
0,"As 'Goldeneye 007' Remaster Finally Leaks Online, Its Original Designer Reacts","Sunday February 07, 2021 01:34PM",(bbc.com),28,PC Games (Games),['EditorDavid'],red
1,Can Artificial Intelligence Restore 85-Year-Old Popeye Cartoons?,"Sunday February 07, 2021 12:34PM",(youtube.com),57,AI,['EditorDavid'],red
2,Fake Pro-China Accounts Are Reaching Millions on Twitter,"Sunday February 07, 2021 11:34AM",(apnews.com),66,China,['EditorDavid'],red
3,Will Misinformation Scare Ghana's Farmers Away From Genetically-Modified Crops?,"Sunday February 07, 2021 10:34AM",(cornell.edu),118,Science,['EditorDavid'],red
4,"'Nature' Urges More Masks, Air Purifiers, and Ventilation Instead of Disinfecting Surfaces","Sunday February 07, 2021 07:34AM",(nature.com),152,Medicine,['EditorDavid'],red
5,Was GameStop's Rise Actually Orchestrated By Hedge Funds?,"Sunday February 07, 2021 04:34AM",(washingtonmonthly.com),107,Businesses,['EditorDavid'],red
6,How the NSA's Hubris Left America Vulnerable,"Sunday February 07, 2021 01:08AM",(nytimes.com),52,United States,['EditorDavid'],red
7,'I Checked Apple's New Privacy Nutrition Labels.  Many Were False.',"Saturday February 06, 2021 09:40PM",(msn.com),72,Privacy,['EditorDavid'],red
8,Highly Educated People More Likely to Fall For QAnon's Conspiracy Theories,"Saturday February 06, 2021 07:34PM",(politico.com),256,Social Networks,['EditorDavid'],red
9,Accused Murderer Wins Right To Check Source Code of DNA Testing Kit,"Saturday February 06, 2021 06:34PM",(theregister.com),158,The Courts,['EditorDavid'],red
10,Raspberry Pi OS Accused of 'Phoning Home' To Microsoft,"Saturday February 06, 2021 05:34PM",(hothardware.com),90,Microsoft,['EditorDavid'],red
11,"Despite Funny Name Ideas, US Space Force Has a Serious Mission","Saturday February 06, 2021 04:34PM",(upi.com),73,The Military,['EditorDavid'],red
12,AlmaLinux Releases Beta of Their CentOS/RHEL 8 Fork,"Saturday February 06, 2021 03:34PM",(almalinux.org),13,Open Source,['EditorDavid'],red
13,They Stormed the Capitol. Their Apps Tracked Them,"Saturday February 06, 2021 02:34PM",(nytimes.com),250,Cellphones,['EditorDavid'],red
14,"Ban on Wireless Modems In Voting Machines Should be Optional, Suggests US Election Agency","Saturday February 06, 2021 01:34PM",(apnews.com),141,United States,['EditorDavid'],red
15,Chinese Probe Sends Back Its First Picture of Mars,"Saturday February 06, 2021 12:34PM",(theguardian.com),19,Mars,['EditorDavid'],red
16,Has Section 230 Created a 'Vast Web of Vengeance'?,"Saturday February 06, 2021 11:34AM",(nytimes.com),135,Social Networks,['EditorDavid'],red
17,"GameStop, AMC Experienced Their Worst Weeks Ever.  Robinhood Lifts Purchasing Limits","Saturday February 06, 2021 10:34AM",(yahoo.com),68,Businesses,['EditorDavid'],red
18,Denmark Strikes Deal On Artificial Wind Energy Island,"Saturday February 06, 2021 08:00AM",(theguardian.com),47,Power,['BeauHD'],red
19,Galaxy-Size Gravitational-Wave Detector Hints At Exotic Physics,"Saturday February 06, 2021 05:00AM",(scientificamerican.com),43,Space,['BeauHD'],red
20,New Quantum Receiver the First To Detect Entire Radio Frequency Spectrum,"Saturday February 06, 2021 02:00AM",(phys.org),97,Communications,['BeauHD'],red
21,Amy Klobuchar's Big Antitrust Bill Wants To End the Age of Megamergers,"Friday February 05, 2021 10:30PM",(vice.com),174,Government,['BeauHD'],red
22,Customized Apple-Themed Game Boy Color Doubles As An Apple TV Remote,"Friday February 05, 2021 09:15PM",(gizmodo.com),11,Television,['BeauHD'],red
23,SoundCloud To Let Fans Pay Artists Directly,"Friday February 05, 2021 08:50PM",(billboard.com),13,Music,['BeauHD'],orange
24,"IBM Quantum Computers Now Finish Some Tasks In Hours, Not Months","Friday February 05, 2021 08:25PM",(engadget.com),33,IBM,['BeauHD'],red
25,Mac Utility Homebrew Finally Gets Native Apple Silicon and M1 Support,"Friday February 05, 2021 07:45PM",(arstechnica.com),43,OS X,['BeauHD'],red
26,Nissan's 'Office Pod' Imagines a New Kind of Remote Working,"Friday February 05, 2021 07:02PM",(cnn.com),66,Transportation,['BeauHD'],red
27,Robinhood Stops Limiting GameStop Shares,"Friday February 05, 2021 06:20PM",(reuters.com),22,The Almighty Buck,['BeauHD'],red
28,Russian Campaign Promotes Homegrown Vaccine and Undercuts Rivals,"Friday February 05, 2021 05:40PM",(nytimes.com),105,Medicine,['BeauHD'],red
29,Pandemic Drove Sales of 4G and 5G-Enabled PCs To New Record In 2020,"Friday February 05, 2021 05:05PM",(strategyanalytics.com),11,Technology,['msmash'],red
30,"How is Alaska Leading the Nation in Vaccinating Residents? With Boats, Ferries, Planes and Snowmobiles.","Friday February 05, 2021 04:25PM",(washingtonpost.com),56,Medicine,['msmash'],red
31,Myanmar's New Military Government is Now Blocking Twitter and Instagram,"Friday February 05, 2021 03:45PM",(techcrunch.com),62,The Internet,['msmash'],red
32,Plex Media Servers Are Being Abused For DDoS Attacks,"Friday February 05, 2021 03:17PM",(zdnet.com),15,Security,['msmash'],red
33,Google Explores Alternative To Apple's New Anti-Tracking Feature,"Friday February 05, 2021 02:35PM",(bloomberg.com),53,Android,['msmash'],red
34,Dozens of Current and Former Dropbox Employees Allege Gender Discrimination,"Friday February 05, 2021 01:47PM",(venturebeat.com),117,Businesses,['msmash'],red
35,Nevada Bill Would Allow Tech Companies To Create Governments,"Friday February 05, 2021 01:10PM",(apnews.com),168,Government,['msmash'],red
36,Nvidia is Requiring Laptop Makers To Be More Transparent About RTX 30-series Specs,"Friday February 05, 2021 12:36PM",(theverge.com),15,Hardware,['msmash'],red
37,US Senators Propose Limiting Liability Shield For Social Media Platforms,"Friday February 05, 2021 11:46AM",(reuters.com),250,United States,['msmash'],red
38,Google Chrome Sync Feature Can Be Abused For C&C and Data Exfiltration,"Friday February 05, 2021 11:16AM",(zdnet.com),13,Chrome,['msmash'],red
39,India is Restoring 4G Internet in Jammu and Kashmir After 18 Months,"Friday February 05, 2021 10:28AM",(techcrunch.com),16,The Internet,['msmash'],red
40,Google Will Delete Users' Play Music Library Later This Month,"Friday February 05, 2021 09:49AM",(9to5google.com),60,Google,['msmash'],red
41,"Fewer Children Are Attending School, Remotely and In Person","Friday February 05, 2021 09:00AM",(wsj.com),146,Education,['msmash'],red
42,Pakistan Forced Down Apps Made By a Persecuted Religious Minority,"Friday February 05, 2021 08:00AM",(buzzfeednews.com),94,Software,['BeauHD'],red
43,Google Launches News Showcase In Australia Amid Dispute Over Proposed Law,"Friday February 05, 2021 05:00AM",(zdnet.com),15,Australia,['BeauHD'],red
44,The Empire State Building and Its Related Buildings Are Now Powered By Wind,"Friday February 05, 2021 02:00AM",(thehill.com),187,Power,['BeauHD'],red
45,The Open-Source Magma Project Will Become 5G's Linux,"Thursday February 04, 2021 10:30PM",(zdnet.com),28,Open Source,['BeauHD'],red
46,Samsung Considers Austin For $17 Billion Chip Plant,"Thursday February 04, 2021 09:02PM",(reuters.com),67,Businesses,['BeauHD'],red
47,Google Boots 'The Great Suspender' Off the Chrome Web Store For Being Malware,"Thursday February 04, 2021 08:25PM",(xda-developers.com),48,Chrome,['BeauHD'],red
48,Biden Commerce Pick Sees 'No Reason' To Lift Huawei Curbs,"Thursday February 04, 2021 07:45PM",(bloomberg.com),91,China,['msmash'],red
49,A New Lens Technology Is Primed To Jump-Start Phone Cameras,"Thursday February 04, 2021 07:02PM",(wired.com),44,Cellphones,['BeauHD'],red
50,23andMe Is Going Public As It Pushes Further Into Healthcare,"Thursday February 04, 2021 06:40PM",Empty,16,Medicine,['BeauHD'],orange
51,"Apple Watch Can Help Track Parkinson's Disease Symptoms, Research Shows","Thursday February 04, 2021 06:20PM",(movementdisorders.org),8,Medicine,['BeauHD'],green
52,SolarWinds Patches Vulnerabilities That Could Allow Full System Control,"Thursday February 04, 2021 05:40PM",(arstechnica.com),15,Security,['BeauHD'],red
53,Voting Technology Company Files $2.7 Billion Lawsuit Against Fox News and Others,"Thursday February 04, 2021 05:03PM",(nytimes.com),309,The Courts,['BeauHD'],red
54,Amazon is Using AI-Equipped Cameras in Delivery Vans,"Thursday February 04, 2021 04:25PM",(cnbc.com),86,Privacy,['msmash'],red
55,"SpaceX Says Its Starlink Satellite Internet Service Now Has Over 10,000 Users","Thursday February 04, 2021 03:50PM",(slashdot.org),92,The Internet,['msmash'],red
56,"Spotify Plans For Podcast Subscriptions, a la carte Payments","Thursday February 04, 2021 03:15PM",(techcrunch.com),14,Businesses,['msmash'],red
57,Chromium Cleans Up Its Act -- and Daily DNS Root Server Queries Drop by 60 Billion,"Thursday February 04, 2021 02:25PM",(theregister.com),35,Chromium,['msmash'],red
58,"San Francisco Sues Its Own School District, Board Over Reopening","Thursday February 04, 2021 01:46PM",(nbcnews.com),142,Education,['msmash'],red
59,Pixel Phones Will Be Able To Read Your Heart Rate With Their Cameras,"Thursday February 04, 2021 01:05PM",(theverge.com),28,Google,['msmash'],red
60,"Microsoft Launches Viva, Its New Take on the Old Intranet","Thursday February 04, 2021 12:25PM",(techcrunch.com),56,Microsoft,['msmash'],red
61,Myanmar Blocks Facebook as Resistance Grows To Coup,"Thursday February 04, 2021 11:45AM",(apnews.com),76,Facebook,['msmash'],red
62,Israel's Vaccination Drive Reduces Covid Cases Among Older Citizens,"Thursday February 04, 2021 11:05AM",(bloomberg.com),69,Medicine,['msmash'],red
63,"Apple's Mixed Reality Headset Could Cost $3,000 and Include 8K Displays","Thursday February 04, 2021 10:31AM",(engadget.com),73,Apple,['msmash'],red
64,AT&T Customer Since 1960 Buys WSJ Print Ad To Complain of Slow Speeds,"Thursday February 04, 2021 09:45AM",(arstechnica.com),160,AT&T,['msmash'],red
65,Two Google Engineers Resign Over Firing of AI Ethics Researcher Timnit Gebru,"Thursday February 04, 2021 09:03AM",(reuters.com),124,Google,['msmash'],red
66,Wall Street Is Keeping Very Close Tabs On WallStreetBets,"Thursday February 04, 2021 08:00AM",(cnn.com),53,Businesses,['BeauHD'],red
67,"Chemists Create and Capture Einsteinium, the Elusive 99th Element","Thursday February 04, 2021 05:00AM",(livescience.com),50,Science,['BeauHD'],red
68,Robots Are Speeding Up the Most Boring Job In Astronomy,"Thursday February 04, 2021 02:00AM",(sciencemag.org),20,Robotics,['BeauHD'],red
69,Remote Tasmanian Island To Be Powered By 'Blowhole' Energy That Harnesses Waves,"Wednesday February 03, 2021 10:30PM",(theguardian.com),91,Power,['BeauHD'],red
70,Clearview AI Violated Canadian Privacy Law,"Wednesday February 03, 2021 09:02PM",(www.cbc.ca),53,AI,['BeauHD'],red
71,Malicious Chrome and Edge Add-Ons Had a Novel Way To Hide On 3 Million Devices,"Wednesday February 03, 2021 08:25PM",(arstechnica.com),18,Chrome,['BeauHD'],red
72,Parler CEO John Matze Says Company's Board Fired Him,"Wednesday February 03, 2021 07:50PM",(axios.com),252,Social Networks,['BeauHD'],red
73,Amazon's Next CEO Says He's Committed To Making Video Games,"Wednesday February 03, 2021 07:02PM",(bloomberg.com),50,Businesses,['BeauHD'],red
74,Pornhub Announces 'Biometric Technology' To Verify Users,"Wednesday February 03, 2021 06:20PM",(vice.com),61,Privacy,['BeauHD'],red
75,Elon Musk Admits Tesla Has Quality Problems,"Wednesday February 03, 2021 05:40PM",(cnn.com),151,Transportation,['BeauHD'],red
76,"Boston Dynamics' Robot Dog Gets an Arm Attachment, Self-Charging Capabilities","Wednesday February 03, 2021 05:02PM",(arstechnica.com),51,Robotics,['BeauHD'],red
77,General Motors Hit by Chip Shortage,"Wednesday February 03, 2021 04:25PM",(reuters.com),79,Transportation,['msmash'],red
78,Over 300 Million Indians May Have COVID-19,"Wednesday February 03, 2021 03:45PM",(reuters.com),132,Science,['msmash'],red
79,Sony Says It Sold 4.5 Million PlayStation 5 Consoles Last Year and Took a Loss on Sales,"Wednesday February 03, 2021 03:05PM",(polygon.com),41,PlayStation (Games),['msmash'],red
80,Recent Root-Giving Sudo Bug Also Impacts macOS,"Wednesday February 03, 2021 02:25PM",(zdnet.com),24,Bug,['msmash'],red
81,"Spacewalkers Complete Battery Replacement Work, Install New Cameras on Space Station","Wednesday February 03, 2021 01:45PM",(cbsnews.com),11,ISS,['msmash'],red
82,"Hackers Lurked in SolarWinds Email System for at Least 9 Months, CEO Says","Wednesday February 03, 2021 01:05PM",(wsj.com),23,Security,['msmash'],red
83,Google's New Subsea Cable Between the US and Europe is Now Online,"Wednesday February 03, 2021 12:30PM",Empty,56,The Internet,['msmash'],red
84,Microsoft Defender ATP is Detecting Yesterday's Chrome Update as a Backdoor,"Wednesday February 03, 2021 11:44AM",(zdnet.com),56,Security,['msmash'],red
85,Microsoft Slams Google Over Threat To Shut Search Engine in Australia,"Wednesday February 03, 2021 11:11AM",(ft.com),44,Australia,['msmash'],red
86,"Apple Will Invest $3.6 Billion In Kia Motors To Build An Apple Car, Claims Report","Wednesday February 03, 2021 10:25AM",(mashable.com),145,Transportation,['msmash'],red
87,Reddit Trading Frenzy Fades as Yellen Summons Agencies,"Wednesday February 03, 2021 09:57AM",(reuters.com),177,The Almighty Buck,['msmash'],red
88,"Amazon's Anti-Union Blitz Stalks Alabama Warehouse Workers Everywhere, Even the Bathroom","Wednesday February 03, 2021 09:10AM",(washingtonpost.com),118,Businesses,['msmash'],red
89,South Korea Leads World In Innovation; US Drops Out of Top 10,"Wednesday February 03, 2021 08:00AM",(bloomberg.com),125,United States,['BeauHD'],red
90,Astronomers Detect Extended Dark Matter Halo Around Ancient Dwarf Galaxy,"Wednesday February 03, 2021 05:00AM",(phys.org),47,Space,['BeauHD'],red
91,Amazon's Next Headquarters Is a Glass Poop Emoji Covered In Trees,"Wednesday February 03, 2021 02:00AM",(theverge.com),107,Businesses,['BeauHD'],red
92,Fauci Says CDC May Recommend Wearing Two Masks To Fight Virus,"Tuesday February 02, 2021 10:30PM",(bloomberg.com),318,Medicine,['BeauHD'],red
93,There's a Curious Effect Urban Trees Might Have On Depression,"Tuesday February 02, 2021 08:50PM",(sciencealert.com),81,Medicine,['BeauHD'],red
94,Hacker Group Inserted Malware In NoxPlayer Android Emulator,"Tuesday February 02, 2021 08:10PM",(zdnet.com),2,Emulation (Games),['BeauHD'],red
95,"Tesla Recalls Roughly 135,000 Vehicles Over Touchscreen Failures","Tuesday February 02, 2021 07:30PM",(cnn.com),36,Transportation,['BeauHD'],red
96,Comcast Lifts Uploads To 5Mbps Amid Complaints Its Low-Income Plan Is Too Slow,"Tuesday February 02, 2021 06:50PM",(arstechnica.com),24,The Internet,['BeauHD'],red
97,Miami Is Considering Paying Its City Employees In Bitcoin,"Tuesday February 02, 2021 06:10PM",(forbes.com),102,Bitcoin,['BeauHD'],red
98,Google Cloud Lost $5.61 Billion On $13.06 Billion Revenue Last Year,"Tuesday February 02, 2021 05:30PM",(cnbc.com),24,Cloud,['BeauHD'],red
99,Robinhood Screwed Its Users But Is More Popular Than Ever,"Tuesday February 02, 2021 04:50PM",(vice.com),60,Businesses,['BeauHD'],red
100,Jeff Bezos To Step Down as Amazon CEO,"Tuesday February 02, 2021 04:13PM",(cnbc.com),68,Businesses,['msmash'],red
101,SpaceX's Starship Launches and Again Crashes in Test of Prototype,"Tuesday February 02, 2021 04:00PM",(nytimes.com),80,Space,['msmash'],red
102,Ransomware Gangs Made at Least $350 Million in 2020,"Tuesday February 02, 2021 03:45PM",(zdnet.com),14,Security,['msmash'],red
103,Suspected Chinese Hackers Used SolarWinds Bug To Spy on US Payroll Agency,"Tuesday February 02, 2021 03:07PM",(reuters.com),18,Security,['msmash'],red
104,Why Webcams Aren't Good Enough,"Tuesday February 02, 2021 02:31PM",(reincubate.com),118,IT,['msmash'],red
105,GameStop Shares Plunge as Traders Dump Stock,"Tuesday February 02, 2021 01:59PM",(theguardian.com),160,The Almighty Buck,['msmash'],red
106,Wikipedia Unveils 'Code Of Conduct' To Stem Misinformation,"Tuesday February 02, 2021 01:12PM",(yahoo.com),100,Wikipedia,['msmash'],red
107,Scientists Have Taught Spinach To Send Emails,"Tuesday February 02, 2021 12:31PM",(euronews.com),83,Science,['msmash'],red
108,Internet Blackouts Skyrocket Amid Global Political Unrest,"Tuesday February 02, 2021 11:45AM",(axios.com),51,The Internet,['msmash'],red
109,"Britain is Cracking Down on the $3.7 Billion 'Buy Now, Pay Later' Industry","Tuesday February 02, 2021 11:05AM",(cnbc.com),131,Businesses,['msmash'],red
110,Amazon To Pay $61.7 Million To Settle FTC Charges It Withheld Some Customer Tips from Amazon Flex Drivers,"Tuesday February 02, 2021 10:27AM",(ftc.gov),32,United States,['msmash'],red
111,Uber Buying Booze Delivery Company Drizly For $1.1 Billion,"Tuesday February 02, 2021 09:42AM",(axios.com),45,Businesses,['msmash'],red
112,Robinhood Plummets Back Down To a One-Star Rating on Google Play,"Tuesday February 02, 2021 09:03AM",(theverge.com),97,Android,['msmash'],red
113,Electric Cars Would Save America Huge Amounts of Energy,"Tuesday February 02, 2021 08:00AM",(bloomberg.com),397,Power,['BeauHD'],red
114,"Amazon's Ring Now Reportedly Partners With More Than 2,000 US Police and Fire Departments","Tuesday February 02, 2021 05:00AM",(theverge.com),71,Crime,['BeauHD'],red
115,SpaceX Announces First-Ever All-Civilian Space Flight Crew,"Tuesday February 02, 2021 02:00AM",(cnn.com),61,Space,['BeauHD'],red
116,Exxon Mobil To Invest $3 Billion In Carbon Capture and Other Projects To Lower Emissions,"Mday February 01, 2021 10:30PM",(nytimes.com),83,The Almighty Buck,['BeauHD'],red
117,Robinhood CEO To Testify Before Maxine Waters' Panel On GameStop,"Mday February 01, 2021 09:03PM",(politico.com),79,Government,['BeauHD'],red
118,Reddit Users Revolt Against the iOS App's New Video Player,"Mday February 01, 2021 08:25PM",(xda-developers.com),41,IOS,['BeauHD'],red
119,Elon Musk Says His Start-Up Neuralink Has Wired Up a Monkey To Play Video Games Using Its Mind,"Mday February 01, 2021 07:45PM",(cnbc.com),72,Games,['BeauHD'],red
120,Ex-Googler Turns Virtual Gifts Into a $61 Billion Business,"Mday February 01, 2021 07:02PM",(bloomberg.com),29,Businesses,['BeauHD'],red
121,iOS 14.5 Will Support PS5 DualSense and Xbox Series X Controllers,"Mday February 01, 2021 06:20PM",(theverge.com),18,IOS,['BeauHD'],red
122,Facebook Testing Notification To Users About Apple Privacy Changes,"Mday February 01, 2021 05:40PM",(axios.com),32,Facebook,['BeauHD'],red
123,Hedge Fund Melvin Sustains 53% Loss After Reddit Onslaught,"Mday February 01, 2021 05:02PM",(arstechnica.com),189,The Almighty Buck,['BeauHD'],red
124,iOS 14.5 Tries To Solve Face ID's Mask Problem With Your Apple Watch,"Mday February 01, 2021 04:25PM",(theverge.com),39,IOS,['msmash'],red
125,"VideoLAN, Maker of Popular Media Player VLC, Turns 20","Mday February 01, 2021 03:43PM",Empty,53,Open Source,['msmash'],red
126,"Google Stadia Shuts Down Internal Studios, Changing Business Focus","Mday February 01, 2021 03:05PM",(kotaku.com),43,Google,['msmash'],red
127,"IBM Blockchain Is a Shell of Its Former Self After Revenue Misses, Job Cuts","Mday February 01, 2021 02:25PM",(coindesk.com),73,IBM,['msmash'],red
128,Xiaomi Sues US Seeking To Reverse Investment Ban,"Mday February 01, 2021 01:43PM",(bloomberg.com),38,Government,['msmash'],red
129,Google Snags Ford Cloud Partnership in Coup Over Microsoft,"Mday February 01, 2021 01:06PM",(bloomberg.com),42,Google,['msmash'],red
130,Robinhood Raises Another $2.4 Billion as Broker App Deals With Retail Trading Frenzy,"Mday February 01, 2021 12:25PM",(cnbc.com),79,Businesses,['msmash'],red
131,Amazon Says Government Demands For User Data Spiked By 800% in 2020,"Mday February 01, 2021 11:45AM",(techcrunch.com),31,Security,['msmash'],red
132,"As Google Eyes Australia Exit, Microsoft Talks Bing With Prime Minister","Mday February 01, 2021 11:06AM",(reuters.com),142,Australia,['msmash'],red
133,Elon Musk Grills Robinhood CEO Over GameStop Trading Freeze: 'The People Demand Answers',"Mday February 01, 2021 10:25AM",(washingtonpost.com),113,The Almighty Buck,['msmash'],red
134,Twitter Blocks Numerous High-Profile Accounts in India Following Government's 'Legal demand',"Mday February 01, 2021 09:43AM",(techcrunch.com),25,Twitter,['msmash'],red
135,Internet Disrupted in Myanmar Amid Apparent Military Uprising,"Mday February 01, 2021 09:00AM",(netblocks.org),47,Facebook,['msmash'],red
136,New Study: A Zero-Emissions America is Now Pretty Cheap,"Mday February 01, 2021 06:34AM",(arstechnica.com),240,Earth,['EditorDavid'],red
137,Did SpaceX's Explosive Starship Test Violate Its Launch License?,"Mday February 01, 2021 03:34AM",(theverge.com),210,Space,['EditorDavid'],red
138,"While Recreating CentOS as 'Rocky Linux', Gregory Kurtzer Also Launches a Sponsoring Startup","Sunday January 31, 2021 11:34PM",(arstechnica.com),63,Open Source,['EditorDavid'],red
139,Google Gave Top Spot For 'Home Depot' Searches to a Malicious Ad,"Sunday January 31, 2021 09:34PM",(bleepingcomputer.com),69,Google,['EditorDavid'],red
140,"To Re-Enable Flash Support, South Africa's Tax Agency Released Its Own Web Browser","Sunday January 31, 2021 07:34PM",(zdnet.com),151,Chromium,['EditorDavid'],red
141,Biofuel-Powered Rocket Makes Historic Launch in Maine,"Sunday January 31, 2021 06:34PM",(pressherald.com),54,Space,['EditorDavid'],red
142,CNN:  Tesla's Net Profit 'Doesn't Come From Selling Cars',"Sunday January 31, 2021 05:34PM",(cnn.com),202,Businesses,['EditorDavid'],red
143,"A 'Severe' Bug Was Found In Libgcrypt, GnuPG's Cryptographic Library","Sunday January 31, 2021 04:34PM",(helpnetsecurity.com),39,GNU is Not Unix,['EditorDavid'],red
144,A 25-Year-Old Bet Comes Due: Has Tech Destroyed Society?,"Sunday January 31, 2021 03:34PM",(wired.com),216,The Media,['EditorDavid'],red
145,"Corporate Trolls?  A Covert, Pro-Huawei Influence Campaign on Social Media","Sunday January 31, 2021 02:34PM",(indianexpress.com),46,China,['EditorDavid'],red
146,Is Misinformation on Nextdoor Impacting Local Politics?,"Sunday January 31, 2021 01:34PM",(medium.com),85,Social Networks,['EditorDavid'],red
147,Hitchhiker's Guide To the Galaxy: New Research Says #42 Really Is Our Number,"Sunday January 31, 2021 12:34PM",(sapub.org),91,Math,['EditorDavid'],red
148,Researchers Try Using CRISPR To Genetically Engineer Zika-Resistant Mosquitoes,"Sunday January 31, 2021 11:34AM",(cornell.edu),31,Biotech,['EditorDavid'],red
149,Are We Overestimating the Number of COBOL Transactions Each Day?,"Sunday January 31, 2021 10:34AM",(archive.org),90,Stats,['EditorDavid'],red
150,"Firefox 85 Isolated Supercookies, But Dropped Progressive Web App Support","Sunday January 31, 2021 07:34AM",(thurrott.com),72,Firefox,['EditorDavid'],red
151,"Perl.com Domain Stolen, Now Using IP Address of Past Malware Campaigns","Sunday January 31, 2021 03:34AM",(bleepingcomputer.com),90,Perl,['EditorDavid'],red
152,Will Mark Zuckerberg Retire From Facebook in 2022?,"Sunday January 31, 2021 12:34AM",(cringely.com),51,Facebook,['EditorDavid'],red
153,"With New User-Defined Functions, Microsoft Excel is Now Turing Complete","Saturday January 30, 2021 09:34PM",(visualstudiomagazine.com),109,Microsoft,['EditorDavid'],green
154,"'Recovering' QAnon Members Seek Help from Therapists, Subreddits, and On Telegram","Saturday January 30, 2021 07:34PM",(go.com),397,Social Networks,['EditorDavid'],red
155,The Problems of Touchscreens In the F-35 Joint Strike Fighter,"Saturday January 30, 2021 06:34PM",(boingboing.net),138,The Military,['EditorDavid'],red
156,"The US Government's Entire 645,000-Vehicle Fleet Will Go All-Electric","Saturday January 30, 2021 05:30PM",(msn.com),216,Power,['EditorDavid'],red
157,Could This Powerful New Fusion Rocket Thruster Propel Us Beyond Mars?,"Saturday January 30, 2021 04:34PM",(sky.com),88,Mars,['EditorDavid'],red
158,Phone Numbers For 533 Million Facebook Users Were Being Sold On Telegram,"Saturday January 30, 2021 03:34PM",(theverge.com),35,Privacy,['EditorDavid'],red
159,Study Finds The Least-Affordable City for Tech Workers:  Silicon Valley's San Jose,"Saturday January 30, 2021 02:34PM",(thestar.com.my),63,IT,['EditorDavid'],red
160,Are the US Military's GPS Tests Threatening Airline Safety?,"Saturday January 30, 2021 01:34PM",(ieee.org),119,United States,['EditorDavid'],red
161,"'Terms of Service' Agreements Are Unbalanced, Need Reforming, Urges New York Times","Saturday January 30, 2021 12:34PM",(nytimes.com),53,Social Networks,['EditorDavid'],red
162,Can Oklahoma Return Its $2 Million Stockpile of Hydroxychloroquine?,"Saturday January 30, 2021 11:34AM",(readfrontier.org),205,United States,['EditorDavid'],red
163,"How Reddit's Co-Founder, Jim Cramer, and Wall Street Reacted to GameStop's Surge","Saturday January 30, 2021 10:34AM",(cnn.com),180,Businesses,['EditorDavid'],red
164,US Intelligence Officials Say Chinese Government Is Collecting Americans' DNA,"Saturday January 30, 2021 08:00AM",(cbsnews.com),95,China,['BeauHD'],red
165,Biden Orders Sweeping Review of Government Science Integrity Policies,"Saturday January 30, 2021 05:00AM",(sciencemag.org),162,Government,['BeauHD'],red
166,Surround Sound From Lightweight Roll-To-Roll Printed Loudspeaker Paper,"Saturday January 30, 2021 02:00AM",(phys.org),21,Science,['BeauHD'],green
167,Amazon Can Make Just About Anything -- Except a Good Video Game,"Friday January 29, 2021 10:30PM",(bloomberg.com),97,Games,['BeauHD'],red
168,Tesla Roadster Delayed To 2022,"Friday January 29, 2021 09:02PM",(electrek.co),59,Transportation,['BeauHD'],red
169,'Meme Stock' Rally Rescues AMC Theaters From $600 Million Debt,"Friday January 29, 2021 07:45PM",(polygon.com),75,Businesses,['BeauHD'],red
170,"Cable ISP Warns 'Excessive' Uploaders, Says Network Can't Handle Heavy Usage","Friday January 29, 2021 07:02PM",(arstechnica.com),101,The Internet,['BeauHD'],red
171,"Visa Wants To Work With Exchanges, Wallets On 'Digital Gold' Bitcoin","Friday January 29, 2021 06:20PM",(cryptonews.com),11,Bitcoin,['BeauHD'],green
