,title,date,exlink,comments,category,user,popular
691,Jack Ma's Disappearing Act Fuels Speculation About Billionaire's Whereabouts,"Mday January 04, 2021 02:01PM",(reuters.com),101,China,['msmash'],red
692,Microsoft Planning 'Sweeping Visual Rejuvenation of Windows',"Mday January 04, 2021 01:13PM",(theverge.com),284,Microsoft,['msmash'],red
693,"Haven, the Amazon-Berkshire-JPMorgan Venture To Disrupt Healthcare, is Disbanding After 3 Years","Mday January 04, 2021 12:33PM",(cnbc.com),163,Businesses,['msmash'],red
694,Apple Has Purportedly Asked Foxconn To Create Two Foldable iPhone Prototype Shells,"Mday January 04, 2021 11:52AM",(gizmodo.com),29,Iphone,['msmash'],red
695,Slack Starts 2021 With a Massive Outage,"Mday January 04, 2021 11:12AM",(theverge.com),24,Businesses,['msmash'],red
696,Julian Assange Extradition To US Blocked by UK Judge,"Mday January 04, 2021 10:26AM",(bbc.com),156,United Kingdom,['msmash'],red
697,Xbox Series X and S Shortages Have Microsoft Asking AMD for Help,"Mday January 04, 2021 09:56AM",(gizmodo.com),32,AMD,['msmash'],red
698,"Google Workers Unionize, Escalating Tension With Management","Mday January 04, 2021 09:03AM",(bloomberg.com),200,Google,['msmash'],red
699,71-Year-Old Slashdot Reader Describes His 'Moderate' Case of Covid,"Mday January 04, 2021 06:34AM",(researchandideas.com),279,Medicine,['EditorDavid'],red
700,A Giant Black Hole Keeps Evading Detecting and Scientists Can't Explain It,"Mday January 04, 2021 03:34AM",(space.com),41,Space,['EditorDavid'],red
701,The Most-Pirated TV Show of 2020 Was 'The Mandalorian',"Mday January 04, 2021 12:34AM",(cnet.com),99,Piracy,['EditorDavid'],red
702,"When Big Brands Stopped Spending On Digital Ads, Nothing Happened. Why?","Sunday January 03, 2021 09:37PM",(forbes.com),238,Advertising,['EditorDavid'],red
703,Will There Be a Commercial Replacement for the International Space Station?,"Sunday January 03, 2021 07:34PM",(thehill.com),96,ISS,['EditorDavid'],red
704,The Atlantic Urges Humankind to Fix the Social Web,"Sunday January 03, 2021 06:23PM",(theatlantic.com),121,Facebook,['EditorDavid'],green
705,Do Children Really Need To Learn To Code?,"Sunday January 03, 2021 04:59PM",(nytimes.com),310,Education,['EditorDavid'],red
706,Speculation Grows As AMD Files Patent for GPU Design,"Sunday January 03, 2021 03:54PM",(hothardware.com),39,AMD,['EditorDavid'],red
707,Study Finds Brain Activity of Coders Isn't Like Language or Math,"Sunday January 03, 2021 02:49PM",(boingboing.net),88,Programming,['EditorDavid'],green
708,Bitcoin Surges 25% In One Week.  Warren Buffett Still Won't Buy It,"Sunday January 03, 2021 01:45PM",(forbes.com),217,Bitcoin,['EditorDavid'],red
709,Is the US Government's Cybersecurity Agency Up to the Job?,"Sunday January 03, 2021 12:39PM",(cnn.com),71,Security,['EditorDavid'],red
710,"Recovering Samples From the Moon, China's Chang'e-5 Team Used Exoskeletons","Sunday January 03, 2021 11:34AM",(universetoday.com),26,China,['EditorDavid'],red
711,"Flash Is About To Die, But Classic Flash Games Will Live On","Sunday January 03, 2021 10:29AM",(fastcompany.com),45,Graphics,['EditorDavid'],red
712,"Fantasy and Sci-Fi Author Debra Doyle, 1952-2020","Sunday January 03, 2021 09:24AM",(locusmag.com),24,Books,['EditorDavid'],red
713,"G.E. Wind Turbine Prototype: 853 Feet Tall, Can Generate 13 Megawatts","Sunday January 03, 2021 06:19AM",(nytimes.com),315,Power,['EditorDavid'],red
714,Mozilla Is Working On a Firefox Design Refresh,"Sunday January 03, 2021 03:14AM",(ghacks.net),246,Firefox,['EditorDavid'],red
715,Are We Experiencing a Great Software Stagnation?,"Saturday January 02, 2021 11:09PM",(alarmingdevelopment.org),286,Programming,['EditorDavid'],red
716,Among 2020's Most Underreported Stories: Pharmaceutical Profiteering May Accelerate Superbugs,"Saturday January 02, 2021 09:04PM",(projectcensored.org),86,Medicine,['EditorDavid'],red
717,Has 'The Mandalorian' on Disney+ Redeemed the Star Wars Universe?,"Saturday January 02, 2021 06:59PM",(salon.com),242,Star Wars Prequels,['EditorDavid'],red
718,"A Four-Day Work Week Would Be Affordable For Most UK Firms, Says Think Tank","Saturday January 02, 2021 05:54PM",(theguardian.com),139,Government,['EditorDavid'],red
719,See Boston Dynamics' Robots Bust Freakishly Good Moves On the Dance Floor,"Saturday January 02, 2021 04:49PM",(hothardware.com),59,Robotics,['EditorDavid'],red
720,"Microsoft, SolarWinds Face New Criticism Over Russian Breach of US Networks","Saturday January 02, 2021 03:44PM",(msn.com),61,Government,['EditorDavid'],red
721,Lawsuits Filed Against Lyft Alleging Sexual Assaults By Drivers,"Saturday January 02, 2021 02:34PM",(siliconvalley.com),53,The Courts,['EditorDavid'],red
722,EFF Reveals Behind-the-Scenes Account of the Fight to Save .ORG,"Saturday January 02, 2021 01:34PM",(eff.org),46,Electronic Frontier Foundation,['EditorDavid'],red
723,Farming Equipment is Beaming Back 'Reams of Data' To its Manufacturers,"Saturday January 02, 2021 12:34PM",(forbes.com),57,AI,['EditorDavid'],green
724,Neuroscientists' New Theory:  Dreaming Protects the Braincells For Eyesight,"Saturday January 02, 2021 11:34AM",(time.com),73,Science,['EditorDavid'],green
725,How The Band Phish Played Chess Against Its Fans on New Year's Eve,"Saturday January 02, 2021 10:34AM",(jambands.com),14,Music,['EditorDavid'],red
726,Massachusetts To Ban Sale of New Gas-Powered Cars by 2035,"Saturday January 02, 2021 07:00AM",(caranddriver.com),303,Earth,['msmash'],red
727,"Backdoor Account Discovered in More Than 100,000 Zyxel Firewalls, VPN Gateways","Saturday January 02, 2021 05:00AM",(zdnet.com),74,Security,['msmash'],red
728,How the Comics Industry Avoided a 2020 Implosion,"Saturday January 02, 2021 03:30AM",(hollywoodreporter.com),43,Sci-Fi,['msmash'],red
729,"Google's Annual Spectacle at CES is No More, With Tech Show Going Virtual","Saturday January 02, 2021 12:30AM",(cnet.com),9,Google,['msmash'],red
730,Samsung Appears To Have a New Tile Competitor On the Way,"Friday January 01, 2021 09:00PM",(theverge.com),64,Technology,['msmash'],red
731,New Era for UK as It Completes Separation From European Union,"Friday January 01, 2021 06:00PM",(bbc.com),527,United Kingdom,['msmash'],red
732,LG Wants To Put Transparent OLEDs in Restaurants and Subways,"Friday January 01, 2021 05:00PM",(mashable.com),111,Technology,['msmash'],red
733,The Problem With Problem Sharks,"Friday January 01, 2021 04:00PM",(nytimes.com),100,Earth,['msmash'],red
734,Party Like It's 1925 On Public Domain Day,"Friday January 01, 2021 03:00PM",(npr.org),103,Books,['msmash'],red
735,New York City Subway Now Supports Tap-To-Pay At All Stations,"Friday January 01, 2021 02:00PM",(theverge.com),47,Transportation,['msmash'],red
736,An Interview With an Anonymous Amazonian,"Friday January 01, 2021 01:00PM",(logicmag.io),201,Cloud,['msmash'],red
737,Forget the Streaming Wars -- Pandemic-Stricken 2020 Lifted Netflix and Others,"Friday January 01, 2021 12:00PM",(wsj.com),6,Television,['msmash'],red
738,Google Maps' Moat is Evaporating,"Friday January 01, 2021 11:00AM",(substack.com),64,Businesses,['msmash'],red
739,Japan's Brand New Anti-Piracy Law Goes Live,"Friday January 01, 2021 10:05AM",(torrentfreak.com),39,Japan,['msmash'],red
740,Amazon To Expand Its Childhood-To-Career CS Program To India Later This Year,"Friday January 01, 2021 06:40AM",Empty,43,Education,['msmash'],red
741,Tech's Top Seven Companies Added $3.4 Trillion in Value in 2020,"Friday January 01, 2021 04:20AM",(cnbc.com),60,The Almighty Buck,['msmash'],red
742,"It's Game Over For FarmVille, as Flash Also Buys the Farm","Friday January 01, 2021 12:30AM",(bloomberg.com),110,Games,['msmash'],red
743,NYSE To Delist Chinese Telco Giants on US Executive Order,"Thursday December 31, 2020 09:30PM",(bloomberg.com),82,United States,['msmash'],red
744,"Alphabet Unit Wing Blasts New US Drone ID Rule, Citing Privacy","Thursday December 31, 2020 08:38PM",(reuters.com),105,Privacy,['msmash'],red
745,Trade-in Site Gazelle is Ending Trade-ins,"Thursday December 31, 2020 05:00PM",(theverge.com),27,Businesses,['msmash'],red
746,"T-Mobile Data Breach Exposed Phone Numbers, Call Records","Thursday December 31, 2020 04:00PM",(bleepingcomputer.com),14,Security,['msmash'],red
747,Microsoft Says SolarWinds Hackers Viewed Source Code,"Thursday December 31, 2020 03:00PM",(cnet.com),47,Microsoft,['msmash'],red
748,Ten-Year Long Study Confirms No Link Between Playing Violent Video Games as Early as Ten Years Old and Aggressive Behavior Later in Life,"Thursday December 31, 2020 02:00PM",(gamesage.net),95,Games,['msmash'],red
749,Apple Took Three Years to Cut Ties With Supplier That Used Underage Labor,"Thursday December 31, 2020 01:00PM",(theinformation.com),83,Businesses,['msmash'],red
750,Mitsubishi Heavy To Build Biggest Zero-Carbon Steel Plant,"Thursday December 31, 2020 12:00PM",(nikkei.com),135,Earth,['msmash'],red
751,'Companies Are Fleeing California. Blame Bad Government.',"Thursday December 31, 2020 11:00AM",(bloomberg.com),497,Businesses,['msmash'],red
752,The ESPN+ Annual Subscription is Going Up by $10,"Thursday December 31, 2020 10:00AM",(engadget.com),56,Media,['msmash'],red
753,"CISA Updates SolarWinds Guidance, Tells US Govt Agencies To Update Right Away","Thursday December 31, 2020 09:00AM",(zdnet.com),27,Security,['msmash'],red
754,Adobe Now Shows Alerts in Windows 10 To Uninstall Flash Player,"Thursday December 31, 2020 06:30AM",(bleepingcomputer.com),61,Windows,['msmash'],red
755,Most-Played Song of 2020? For Many It's White Noise,"Thursday December 31, 2020 04:00AM",(nytimes.com),59,Music,['msmash'],red
756,Ticketmaster Pays $10 Million Criminal Fine for Invading Rival's Computers,"Thursday December 31, 2020 01:00AM",(yahoo.com),64,Businesses,['msmash'],red
757,SpaceX Will Attempt To Recover Super Heavy Rocket by Catching it With Launch Tower,"Wednesday December 30, 2020 09:25PM",(techcrunch.com),130,Space,['msmash'],red
758,Spotify's Podcasting Problem: Loophole Allows Remixes and Unreleased Songs To Hide in Plain Sight,"Wednesday December 30, 2020 08:00PM",(variety.com),24,Music,['msmash'],red
759,Private Party App Pulled From App Store by Apple,"Wednesday December 30, 2020 06:00PM",(arstechnica.com),193,Medicine,['msmash'],red
760,"New Train Hall Opens at Penn Station, Echoing Building's Former Glory","Wednesday December 30, 2020 04:30PM",(nytimes.com),88,United States,['msmash'],red
761,VP and Head Scientist of Alexa at Amazon: 'The Turing Test is Obsolete. It's Time To Build a New Barometer For AI',"Wednesday December 30, 2020 03:28PM",Empty,180,AI,['msmash'],red
762,Amazon To Buy Podcast Maker Wondery,"Wednesday December 30, 2020 02:30PM",(wsj.com),5,Media,['msmash'],red
763,Amazon Still Hasn't Fixed Its Problem With Bait-and-Switch Reviews,"Wednesday December 30, 2020 01:30PM",(arstechnica.com),86,Businesses,['msmash'],red
764,"NSO Used Real People's Location Data To Pitch Its Contact-Tracing Tech, Researchers Say","Wednesday December 30, 2020 12:40PM",(techcrunch.com),19,Privacy,['msmash'],red
765,"A Year After Microsoft Ended All Support for Windows 7, Millions of Users Are Still Not Upgrading","Wednesday December 30, 2020 11:35AM",(zdnet.com),239,Windows,['msmash'],red
766,Study Finds More Than $100 Billion Spent on App Stores in 2020,"Wednesday December 30, 2020 10:33AM",(macrumors.com),23,Businesses,['msmash'],red
767,"Global Digital-Tax Detente Ends, as US and France Exchange Blows","Wednesday December 30, 2020 09:43AM",(wsj.com),70,Government,['msmash'],red
768,"McConnell Ties Full Repeal of Section 230 To Push for $2,000 Stimulus Checks","Wednesday December 30, 2020 06:00AM",(theverge.com),455,United States,['msmash'],red
769,VMware Sues Former Executive Who Left for CEO Job at Nutanix,"Wednesday December 30, 2020 04:30AM",(bloomberg.com),35,Businesses,['msmash'],red
770,"Surprise Ending for Publishers: In 2020, Business Was Good","Wednesday December 30, 2020 02:30AM",(nytimes.com),25,Books,['msmash'],red
771,Apple Loses Copyright Battle Against Security Startup Corellium,"Tuesday December 29, 2020 11:30PM",(washingtonpost.com),84,Apple,['msmash'],red
772,Google's 'Cloud Print' Service is Shutting Down Soon,"Tuesday December 29, 2020 09:30PM",(techspot.com),60,Printer,['msmash'],red
773,Hedge Fund Third Point Urges Intel To Explore Deal Options,"Tuesday December 29, 2020 07:30PM",(reuters.com),115,Intel,['msmash'],red
774,Google Pilots a Search Feature That Aggregates Short-Form Videos From TikTok and Instagram,"Tuesday December 29, 2020 06:25PM",(techcrunch.com),19,Google,['msmash'],red
775,Apple Researching Keyboards With Adaptive Displays on Each Key,"Tuesday December 29, 2020 02:00PM",(macrumors.com),225,Portables (Apple),['msmash'],red
776,Apple's Longtime Supplier Accused of Using Forced Labor in China,"Tuesday December 29, 2020 01:01PM",(washingtonpost.com),157,Businesses,['msmash'],red
777,Police Turn To Car Data To Destroy Suspects' Alibis,"Tuesday December 29, 2020 12:00PM",(nbcnews.com),194,Transportation,['msmash'],red
778,Brexit Deal Mentions Netscape Browser and Mozilla Mail,"Tuesday December 29, 2020 11:00AM",(bbc.com),194,Netscape,['msmash'],red
779,Disney Will Test the Limits of 'Franchise Fatigue' in 2021 and 2022,"Tuesday December 29, 2020 10:00AM",(yahoo.com),129,Movies,['msmash'],red
780,Japan Developing Wooden Satellites To Cut Space Junk,"Tuesday December 29, 2020 09:05AM",(bbc.co.uk),165,Japan,['msmash'],red
781,Neptune's Weird Dark Spot Just Got Weirder,"Tuesday December 29, 2020 07:30AM",(nytimes.com),24,Space,['msmash'],red
782,Coinbase To Suspend Trading in XRP,"Tuesday December 29, 2020 06:01AM",(reuters.com),44,The Almighty Buck,['msmash'],red
783,The Lasting Lessons of John Conway's Game of Life,"Tuesday December 29, 2020 04:00AM",Empty,84,Math,['msmash'],red
784,Apple Launches First-Generation College Student Mentorship Program,"Tuesday December 29, 2020 01:00AM",(macrumors.com),21,Education,['msmash'],red
785,New York Post's Hunter Biden Laptop Source Sues Twitter for Defamation,"Mday December 28, 2020 10:00PM",(theverge.com),468,The Courts,['msmash'],red
786,Tech Giants Are Giving China a Vital Edge In Espionage.,"Mday December 28, 2020 07:08PM",(foreignpolicy.com),108,China,['FirehoseFavorites'],red
787,Finland Says Hackers Accessed MPs' Emails Accounts,"Mday December 28, 2020 04:47PM",(zdnet.com),17,Privacy,['msmash'],red
788,Canon Patents an Osmo-style Camera With Interchangeable Lenses,"Mday December 28, 2020 03:19PM",(engadget.com),25,Technology,['msmash'],red
789,US To Allow Small Drones To Fly Over People at Night,"Mday December 28, 2020 02:14PM",(reuters.com),165,Transportation,['msmash'],red
790,Bitcoin Miners in Nordic Region Get a Boost From Cheap Power,"Mday December 28, 2020 01:02PM",(bloomberg.com),68,Bitcoin,['msmash'],red
791,Tesla To Make India Debut 'Early' Next Year,"Mday December 28, 2020 12:04PM",(techcrunch.com),33,Transportation,['msmash'],red
792,Vietnam Targeted in Complex Supply Chain Attack,"Mday December 28, 2020 11:06AM",(zdnet.com),23,Security,['msmash'],red
793,Scientists Turn CO2 Into Jet Fuel,"Mday December 28, 2020 10:03AM",(wired.com),144,Science,['msmash'],red
794,China Jails Citizen Journalist for Wuhan Reports,"Mday December 28, 2020 08:30AM",(bbc.com),211,China,['msmash'],red
795,Will America's Next President Change Its Space Program?,"Mday December 28, 2020 07:34AM",(bloomberg.com),134,NASA,['EditorDavid'],red
796,Bitcoin Surges 50% in Just One Month. CNN Ponders 'Insane' Record Run,"Mday December 28, 2020 03:35AM",(cnn.com),190,Bitcoin,['EditorDavid'],red
797,Should Cellphone Chargers Be Sold Separately?,"Sunday December 27, 2020 11:29PM",(theverge.com),214,Cellphones,['EditorDavid'],red
798,Linux Kernel Ported to the Nintendo 64,"Sunday December 27, 2020 09:24PM",(phoronix.com),33,Nintendo,['EditorDavid'],red
799,2-Acre Vertical Farm Run By AI and Robots Out-Produces 720-Acre Flat Farm,"Sunday December 27, 2020 07:14PM",(intelligentliving.co),267,AI,['EditorDavid'],green
800,Are Tech Companies Censoring Their Users For Access to China's Market?,"Sunday December 27, 2020 06:09PM",(msnbc.com),85,Censorship,['EditorDavid'],red
801,"Tesla Update Turns Cars into Boomboxes, Adds Three In-Car Videogames and Customizable Honking","Sunday December 27, 2020 05:04PM",(electrek.co),83,Transportation,['EditorDavid'],red
802,"Edmund Clarke, 2007 Winner of the Turing Award, Dies of Covid-19","Sunday December 27, 2020 03:59PM",(post-gazette.com),65,Hardware,['EditorDavid'],red
803,Edward Snowden Urges Donations to the EFF,"Sunday December 27, 2020 02:54PM",(eff.org),99,Electronic Frontier Foundation,['EditorDavid'],red
804,Samples from Ryugu Asteroid Revealed After Delivery to Earth,"Sunday December 27, 2020 02:19PM",(mashable.com),3,Space,['EditorDavid'],orange
805,An Asteroid the Size of a Dwarf Planet Is Lurking In Our Solar System,"Sunday December 27, 2020 01:49PM",(livescience.com),38,Space,['EditorDavid'],red
806,The Further Adventures of that Monolith Stolen in Utah,"Sunday December 27, 2020 12:44PM",(fox13now.com),57,Idle,['EditorDavid'],red
807,"Due to Popular Demand, GM May Build More of Its 'Hummer EV' Electric Pickups","Sunday December 27, 2020 11:39AM",(cnet.com),96,Power,['EditorDavid'],red
808,Basecamp Releases Hotwire for Building Web Applications Using 'HTML Over the Wire',"Sunday December 27, 2020 10:34AM",(hotwire.dev),60,The Internet,['EditorDavid'],green
809,"The Site of Hawaii's First Tesla Supercharger? Probably Larry Ellison's 3,400-Person Island","Sunday December 27, 2020 09:34AM",(electrek.co),31,Power,['EditorDavid'],red
810,Mass Die-Off of Birds in Southwest US 'Probably Linked to Climate Crisis',"Sunday December 27, 2020 07:34AM",(theguardian.com),109,Earth,['EditorDavid'],red
811,Apple Experienced iCloud Issues After Christmas Surge,"Sunday December 27, 2020 04:07AM",(cnet.com),13,Cloud,['EditorDavid'],red
812,How Astronauts on The ISS Got a Visit from Santa,"Sunday December 27, 2020 12:07AM",(thehill.com),28,Christmas Cheer,['EditorDavid'],red
813,The Secret to Longevity?  4-Minute Bursts of Intense Exercise May Help,"Saturday December 26, 2020 09:09PM",(msn.com),82,Medicine,['EditorDavid'],red
814,Will America's Next President Break Up Facebook?,"Saturday December 26, 2020 07:04PM",(politico.com),171,Facebook,['EditorDavid'],red
815,What Happened When Finland Tried to Lure the World's Remote Tech Workers?,"Saturday December 26, 2020 05:59PM",(indiatimes.com),24,EU,['EditorDavid'],green
816,Many Formerly-Skeptical Americans are Now Eager to Get Covid-19 Vaccines,"Saturday December 26, 2020 04:54PM",(deccanherald.com),247,Medicine,['EditorDavid'],red
817,Ask Slashdot:  How Long Should a Vendor Support a Distro?,"Saturday December 26, 2020 03:49PM",Empty,137,Open Source,['EditorDavid'],red
818,America Creates a 770-Mile Corridor for Testing Supersonic Aircraft Up to Mach 3,"Saturday December 26, 2020 02:44PM",(ainonline.com),75,Transportation,['EditorDavid'],red
819,Can mRNA Biotechnology be Adapted to Improve Flu Vaccines and Fight Cancer?,"Saturday December 26, 2020 01:39PM",(reuters.com),75,Biotech,['EditorDavid'],red
820,'Unforced Error' in Suspected Russian Data Breach May Have Led to Its Discovery,"Saturday December 26, 2020 12:34PM",(cnn.com),50,United States,['EditorDavid'],red
821,How San Francisco Got a Very Special Monolith on Christmas Day,"Saturday December 26, 2020 11:34AM",(kqed.org),26,Christmas Cheer,['EditorDavid'],red
822,A Deepfake Queen Delivered an Alternative Christmas Speech to Warn about Misinformation,"Saturday December 26, 2020 10:34AM",(cnn.com),47,United Kingdom,['EditorDavid'],red
823,A New Population of Blue Whales Was Discovered Hiding in the Indian Ocean,"Saturday December 26, 2020 06:30AM",(nytimes.com),45,Earth,['msmash'],red
824,IBM Will Pay $24.25 Million To Resolve FCC Probes,"Saturday December 26, 2020 03:30AM",(reuters.com),13,Communications,['msmash'],red
825,The World's Most Loathed Industry Gave Us a Vaccine in Record Time,"Saturday December 26, 2020 12:30AM",(bloomberg.com),443,Medicine,['msmash'],red
826,MediaTek Becomes Biggest Smartphone Chipset Vendor,"Friday December 25, 2020 10:30PM",(digitimes.com),10,Android,['msmash'],red
827,Quantum Computer Makers Like Their Odds For Big Progress,"Friday December 25, 2020 08:00PM",(cnet.com),31,Technology,['msmash'],red
828,Apple's China App Store Sheds Videogames as Beijing Tightens Internet Control,"Friday December 25, 2020 05:30PM",(wsj.com),79,China,['msmash'],red
829,"Japan To Phase Out Gasoline-Powered Cars, Bucking Toyota Chief","Friday December 25, 2020 04:00PM",(wsj.com),209,Japan,['msmash'],red
830,Discovery of 'Cryptic Species' Shows Earth is Even More Biologically Diverse,"Friday December 25, 2020 03:01PM",(theguardian.com),37,Earth,['msmash'],red
831,Citrix Devices Are Being Abused as DDoS Attack Vectors,"Friday December 25, 2020 02:00PM",(zdnet.com),17,Network,['msmash'],red
832,Scott Hanselman's 2021 Ultimate Developer and Power Users Tool List for Windows,"Friday December 25, 2020 01:00PM",(hanselman.com),65,Windows,['msmash'],red
833,"Redox OS 0.6 Released With Many Fixes, Rewritten Kernel Memory Manager","Friday December 25, 2020 12:00PM",(phoronix.com),63,Operating Systems,['msmash'],red
834,What Are You Paying For in a $300 Chess Set? Mostly the Knights,"Friday December 25, 2020 11:00AM",(nytimes.com),126,News,['msmash'],red
835,Russians Are Believed To Have Used Microsoft Resellers in Cyberattacks,"Friday December 25, 2020 10:00AM",(nytimes.com),50,Security,['msmash'],red
836,Cyberpunk Maker CD Projekt Sued by Investor Over Botched Launch,"Friday December 25, 2020 09:00AM",(bloomberg.com),69,Businesses,['msmash'],red
837,Crypto's Big Rupture Is Coming In 2021,"Friday December 25, 2020 08:00AM",(coindesk.com),86,Bitcoin,['BeauHD'],green
838,Korean Artificial Sun Sets the New World Record of 20-Sec-Long Operation At 100 Million Degrees,"Friday December 25, 2020 05:00AM",(phys.org),52,Power,['BeauHD'],red
839,Video Taken By Pilots of What Could Be the Elusive Los Angeles Jet Pack Guy Emerges,"Friday December 25, 2020 02:00AM",(thedrive.com),61,United States,['BeauHD'],red
840,Microsoft Flight Simulator In VR: a Turbulent Start For Wide-Open Skies,"Thursday December 24, 2020 10:30PM",(arstechnica.com),19,Microsoft,['BeauHD'],red
841,Atomic-Scale Nanowires Can Now Be Produced At Scale,"Thursday December 24, 2020 09:20PM",(phys.org),13,Science,['BeauHD'],green
842,Sony Publishes An Official Linux Driver For PS5 DualSense Controllers,"Thursday December 24, 2020 08:40PM",(phoronix.com),12,PlayStation (Games),['BeauHD'],red
843,"Laptops, Desktop Sales See 'Renaissance;' Shortages Won't Ease Until 2022","Thursday December 24, 2020 08:00PM",(reuters.com),61,Hardware,['BeauHD'],red
844,XRP Cryptocurrency Crashes Following Announcement of SEC Suit Against Ripple,"Thursday December 24, 2020 07:20PM",(techcrunch.com),34,Bitcoin,['BeauHD'],red
845,The ACLU Is Suing For More Information About the FBI's Phone-Hacking Lab,"Thursday December 24, 2020 06:40PM",(theverge.com),31,The Courts,['BeauHD'],red
846,"VISA Continues Pornhub Ban, To Allow Card Use On Some of Its Parent's Sites","Thursday December 24, 2020 06:00PM",(reuters.com),83,The Almighty Buck,['BeauHD'],red
847,Facebook Managers Trash Their Own Ad Targeting In Unsealed Remarks,"Thursday December 24, 2020 05:20PM",(theintercept.com),13,Facebook,['BeauHD'],red
848,Why on Earth Is Someone Stealing Unpublished Book Manuscripts?,"Thursday December 24, 2020 04:41PM",(nytimes.com),42,Books,['msmash'],red
849,Warner Bros. Believes that Theaters Will Still Exist in 2023,"Thursday December 24, 2020 04:00PM",(theverge.com),43,Movies,['msmash'],red
850,GoDaddy Employees Were Told They Were Getting a Holiday Bonus. It Was Actually a Phishing Test.,"Thursday December 24, 2020 03:21PM",Empty,236,Security,['msmash'],red
851,NYC is Paying $2 Million For Anti-Plagiarism Software After Firing Teachers,"Thursday December 24, 2020 02:30PM",(vice.com),44,Software,['msmash'],red
852,Dozens Sue Amazon's Ring After Camera Hack Leads To Threats and Racial Slurs,"Thursday December 24, 2020 01:41PM",(theguardian.com),71,Privacy,['msmash'],red
853,Volkswagen CEO Says Apple Can Mount Major Challenge With Auto Push,"Thursday December 24, 2020 01:01PM",(bloomberg.com),38,Transportation,['msmash'],red
854,Hackers Threaten To Leak Plastic Surgery Pictures,"Thursday December 24, 2020 12:21PM",(bbc.com),33,Security,['msmash'],red
855,"US Cyber Agency Says SolarWinds Hackers Are 'Impacting' State, Local Governments","Thursday December 24, 2020 11:43AM",(reuters.com),35,United States,['msmash'],red
856,'Free Speech' Reddit Clone Voat Says It Will Shut Down on Christmas,"Thursday December 24, 2020 11:01AM",(theverge.com),167,Social Networks,['msmash'],red
857,Square Has Discussed Acquiring Jay-Z's Tidal Service,"Thursday December 24, 2020 10:21AM",(bloomberg.com),4,Businesses,['msmash'],red
858,BMW Backtracks: 'We Do Not Draw on Warranty Status' For Targeted Ads,"Thursday December 24, 2020 09:41AM",(motoringresearch.com),29,Privacy,['msmash'],red
859,China Targets Jack Ma's Alibaba Empire in Monopoly Probe,"Thursday December 24, 2020 09:00AM",(bloomberg.com),63,China,['msmash'],red
860,ExamSoft Flags One-Third of California Bar Exam Test Takers For Cheating,"Thursday December 24, 2020 08:00AM",(eff.org),82,Electronic Frontier Foundation,['BeauHD'],red
861,"KFC Launches 4K, 240FPS Gaming Console With a Built-In Chicken Warmer","Thursday December 24, 2020 05:00AM",Empty,98,Hardware,['BeauHD'],red
862,Photographer Captures ISS Passing Between Jupiter and Saturn,"Thursday December 24, 2020 02:00AM",(petapixel.com),46,ISS,['BeauHD'],red
863,Nuro Becomes First Company To Receive Commercial Autonomous Vehicle Permit From California DMV,"Wednesday December 23, 2020 10:30PM",(venturebeat.com),44,Transportation,['BeauHD'],red
864,Amazon To Face US Union Push In Year Ahead,"Wednesday December 23, 2020 09:02PM",(reuters.com),99,Businesses,['BeauHD'],red
