,title,date,exlink,comments,category,user,popular
1035,Walmart Will Use Fully Driverless Trucks To Make Deliveries In 2021,"Tuesday December 15, 2020 06:20PM",(theverge.com),59,Transportation,['BeauHD'],red
1036,"Senator Tries To Block Frontier's FCC Funding, Citing ISP's Various Failures","Tuesday December 15, 2020 06:00PM",(arstechnica.com),34,The Almighty Buck,['BeauHD'],red
1037,Microsoft and Industry Partners Seize Key Domain Used In SolarWinds Hack,"Tuesday December 15, 2020 05:45PM",(zdnet.com),18,Security,['BeauHD'],red
1038,Microsoft Office Is Now Updated For M1 Macs,"Tuesday December 15, 2020 05:20PM",(theverge.com),61,Microsoft,['BeauHD'],orange
1039,Academics Turn RAM Into Wi-Fi Cards To Steal Data From Air-Gapped Systems,"Tuesday December 15, 2020 05:05PM",(zdnet.com),105,Security,['msmash'],red
1040,AWS Introduces New Chaos Engineering as a Service Offering,"Tuesday December 15, 2020 04:25PM",(techcrunch.com),20,Cloud,['msmash'],red
1041,Hackers at Center of Sprawling Spy Campaign Turned SolarWinds' Dominance Against It,"Tuesday December 15, 2020 03:45PM",(reuters.com),49,Security,['msmash'],red
1042,High-Frequency Traders Push Closer To Light Speed With Cutting-Edge Cables,"Tuesday December 15, 2020 03:08PM",(wsj.com),186,Network,['msmash'],red
1043,FDA Authorizes 1st Home Coronavirus Test That Doesn't Require A Prescription,"Tuesday December 15, 2020 02:30PM",(npr.org),61,Medicine,['msmash'],red
1044,"Facebook To Move UK Users To California Terms, Avoiding EU Privacy Rules","Tuesday December 15, 2020 01:50PM",(reuters.com),67,Facebook,['msmash'],red
1045,"SolarWinds Says 18,000 Customers Were Impacted by Recent Hack","Tuesday December 15, 2020 01:10PM",(zdnet.com),23,Security,['msmash'],red
1046,FDA Approves Genetically Engineered Pigs,"Tuesday December 15, 2020 12:30PM",(theverge.com),76,Science,['msmash'],red
1047,'Google is Getting Left Behind Due To Horrible UI/UX',"Tuesday December 15, 2020 11:50AM",(danielmiessler.com),269,Google,['msmash'],red
1048,Europe Triples Down on Tough Rules for Tech,"Tuesday December 15, 2020 11:10AM",(axios.com),54,Businesses,['msmash'],red
1049,Germany Orders Electric Air Taxis To Carry Emergency Doctors,"Tuesday December 15, 2020 10:26AM",(bloomberg.com),50,Medicine,['msmash'],red
1050,California Fines Uber $59 Million for Stonewalling Questions About Sexual Assaults,"Tuesday December 15, 2020 09:49AM",(marketwatch.com),54,United States,['msmash'],red
1051,Poor Countries Face Long Wait for Vaccines Despite Promises,"Tuesday December 15, 2020 09:06AM",Empty,235,Medicine,['msmash'],red
1052,CloudLinux To Invest More Than a Million Dollars a Year Into CentOS Clone,"Tuesday December 15, 2020 08:00AM",(zdnet.com),85,Cloud,['BeauHD'],red
1053,Reddit Is Buying TikTok Rival Dubsmash,"Tuesday December 15, 2020 05:00AM",(cnn.com),20,Businesses,['BeauHD'],red
1054,Astronomers Discover Cosmic 'Superhighways' For Fast Travel Through the Solar System,"Tuesday December 15, 2020 02:00AM",(sciencealert.com),74,Space,['BeauHD'],red
1055,How Europe's Night Trains Came Back From the Dead,"Mday December 14, 2020 10:30PM",(cnn.com),89,Transportation,['BeauHD'],red
1056,Scientists Just Set a New World Record In Solar Cell Efficiency,"Mday December 14, 2020 09:02PM",(sciencealert.com),105,Power,['BeauHD'],red
1057,Countries Roll Out 2030 Paris Accord Goals Amid US Absence,"Mday December 14, 2020 08:25PM",Empty,128,Earth,['BeauHD'],red
1058,Israeli Spy Tech Firm Says It Can Break Into Signal App,"Mday December 14, 2020 07:45PM",(haaretz.com),87,Encryption,['BeauHD'],red
1059,"GameStop Employees Surprised By New Shipment of PS5, Xbox Series X Consoles","Mday December 14, 2020 07:02PM",(bloomberg.com),28,Businesses,['BeauHD'],red
1060,Apple's Fitness Video Service That Competes With Peloton Is Cheaper and Just As Good,"Mday December 14, 2020 06:20PM",(cnbc.com),28,Apple,['BeauHD'],green
1061,"Electoral College Certifies Biden's Victory, As Trump Still Refuses To Concede","Mday December 14, 2020 06:01PM",(apnews.com),550,Government,['BeauHD'],orange
1062,Apple Launches New App Store Privacy Labels So You Can See How iOS Apps Use Your Data,"Mday December 14, 2020 05:40PM",(theverge.com),7,Privacy,['BeauHD'],red
1063,Here's the 5G Glossary Every American is Apparently Going To Need,"Mday December 14, 2020 05:05PM",(lightreading.com),73,Communications,['msmash'],red
1064,EA Set To Pay $1.2 Billion For Codemasters and Its Stable of Racing Games,"Mday December 14, 2020 04:25PM",(arstechnica.com),28,Businesses,['BeauHD'],red
1065,Vista Acquires IT Education Platform Pluralsight for $3.5B,"Mday December 14, 2020 03:45PM",(techcrunch.com),9,Businesses,['msmash'],red
1066,Suspected Russian Hackers Breached Department of Homeland Security,"Mday December 14, 2020 03:05PM",(reuters.com),55,United States,['msmash'],red
1067,Amazon's Zoox Unveils Robotaxi for Future Ride-Hailing Service,"Mday December 14, 2020 02:24PM",(bloomberg.com),41,Transportation,['msmash'],red
1068,FTC Launches Sweeping Privacy Study of Top Tech Platforms,"Mday December 14, 2020 01:45PM",(axios.com),16,Privacy,['msmash'],red
1069,Amazon Launches Live Translation Mode for Alexa,"Mday December 14, 2020 01:10PM",(venturebeat.com),10,AI,['msmash'],red
1070,'Cyberpunk 2077' Players Are Fixing Parts of the Game Before CD Projekt,"Mday December 14, 2020 12:30PM",(vice.com),79,Bug,['msmash'],red
1071,Google Delays Return To Office and Eyes 'Flexible Work Week',"Mday December 14, 2020 11:50AM",(nytimes.com),27,Google,['msmash'],red
1072,"'New Variant' of Coronavirus Identified in UK, Health Secretary Says","Mday December 14, 2020 11:10AM",(sky.com),74,Medicine,['msmash'],red
1073,Pornhub Just Purged All Unverified Content From the Platform,"Mday December 14, 2020 10:25AM",(vice.com),134,Social Networks,['msmash'],red
1074,Tech Firms Risk Fines of 10% of Sales in EU Power Curb Bid,"Mday December 14, 2020 09:45AM",(bloomberg.com),13,EU,['msmash'],red
1075,"Google Services Including Gmail, YouTube Suffer Major Outage","Mday December 14, 2020 09:02AM",(bloomberg.com),104,Google,['msmash'],red
1076,"John le Carre, Author of Spy Novels, Dies at Age 89","Mday December 14, 2020 07:34AM",(nbcnewyork.com),29,Books,['EditorDavid'],red
1077,Covid-19 Deaths Rose In US College Towns When Students Returned,"Mday December 14, 2020 03:51AM",(deccanherald.com),264,United States,['EditorDavid'],red
1078,"Russia Breached Update Server Used by 300,000 Organizations, Including the NSA","Sunday December 13, 2020 11:51PM",(seattletimes.com),115,Government,['EditorDavid'],red
1079,U.S. Schools are Buying Phone-Hacking Tech That the FBI Uses to Investigate Terrorists,"Sunday December 13, 2020 09:51PM",(gizmodo.com),115,Education,['EditorDavid'],red
1080,Are Hydrogen Fuel Cell Vehicles the Future of Autos?,"Sunday December 13, 2020 07:52PM",(go.com),350,Transportation,['EditorDavid'],red
1081,Creator of DirectX Dies at Age 55,"Sunday December 13, 2020 06:35PM",(livemint.com),94,GUI,['EditorDavid'],red
1082,"Hundreds Riot, Thousands Protest at iPhone Factory in India","Sunday December 13, 2020 05:34PM",(scmp.com),122,Iphone,['EditorDavid'],red
1083,Do Games Made Under Crunch Conditions Deserve 'Best Direction' Awards?,"Sunday December 13, 2020 04:34PM",(kotaku.com),146,Games,['EditorDavid'],red
1084,US Treasury Department Breached by 'Hackers Backed By Foreign Government',"Sunday December 13, 2020 03:34PM",(usnews.com),64,United States,['EditorDavid'],red
1085,'Will Remote Work Kill Innovation?' Ask Silicon Valley Experts,"Sunday December 13, 2020 02:34PM",(mercurynews.com),110,Businesses,['EditorDavid'],red
1086,Nathan Myhrvold's Dazzling High-Resolution Photographs of Snowflakes,"Sunday December 13, 2020 01:34PM",(fastcompany.com),58,Christmas Cheer,['EditorDavid'],green
1087,AstraZeneca Tries Combining Its Covid-19 Vaccine With Russia's 'Sputnik V' Vaccine,"Sunday December 13, 2020 12:34PM",(reuters.com),80,Medicine,['EditorDavid'],red
1088,A History of the American Energy System In One Chart,"Sunday December 13, 2020 11:34AM",(theatlantic.com),64,Earth,['EditorDavid'],green
1089,"Why Apple, Cloudflare, and Fastly Proposed a New Privacy-Focused DNS Standard Called 'Oblivious DoH'","Sunday December 13, 2020 10:34AM",(zdnet.com),64,The Internet,['EditorDavid'],red
1090,Here Comes the Google Chrome Change that Worries Ad-Blocker Creators,"Sunday December 13, 2020 09:34AM",(cnet.com),119,Google,['EditorDavid'],red
1091,America's Covid-19 Hospitalizations Hit a Record High For the 7th Straight Day,"Sunday December 13, 2020 07:34AM",(cnn.com),236,United States,['EditorDavid'],red
1092,Are Fragments of Energy the Fundamental Building Blocks of the Universe?,"Sunday December 13, 2020 04:04AM",(theconversation.com),99,Math,['EditorDavid'],red
1093,"NVIDIA Apologizes, 'Walks Back' Threat to Withhold GPUs From Reviewer","Sunday December 13, 2020 12:34AM",(techspot.com),111,Graphics,['EditorDavid'],red
1094,"America's Covid-19 Deaths Likely to Exceed 9/11's Death Toll Every Day, For Two Months","Saturday December 12, 2020 09:34PM",(thehill.com),387,Medicine,['EditorDavid'],red
1095,Open Source Developers Say Securing Their Code Is 'Insufferably Boring' and 'Soul-Withering',"Saturday December 12, 2020 07:34PM",(techrepublic.com),150,Open Source,['EditorDavid'],red
1096,Drug Reverses Age-Related Mental Decline Within Days,"Saturday December 12, 2020 06:34PM",(ucsf.edu),98,Medicine,['EditorDavid'],red
1097,"Hackers Are Selling More Than 85,000 MySQL Databases On a Dark Web Portal","Saturday December 12, 2020 05:34PM",(zdnet.com),24,Databases,['EditorDavid'],red
1098,NextMind's Brain-Computer Interface Kit Begins Shipping To Developers,"Saturday December 12, 2020 04:34PM",(venturebeat.com),24,AI,['EditorDavid'],red
1099,Google Plans to Calculate 'Criticality' Scores for Open Source Projects,"Saturday December 12, 2020 03:34PM",(thenewstack.io),40,Google,['EditorDavid'],red
1100,Virgin Galactic Unexpectedly Aborted a Test Flight of Its Space Plane,"Saturday December 12, 2020 02:34PM",(cnn.com),34,Space,['EditorDavid'],red
1101,"'Save Europe from Software Patents', Urges Nonprofit FFII","Saturday December 12, 2020 01:34PM",(ffii.org),33,EU,['EditorDavid'],red
1102,Disney Stock Skyrockets 13% Friday to New All-Time High,"Saturday December 12, 2020 12:34PM",(cnn.com),46,Star Wars Prequels,['EditorDavid'],red
1103,Twitter Disabled 'Likes' and 'Replies' on False Trump Tweets.  Inadvertently.,"Saturday December 12, 2020 11:34AM",(msn.com),191,Twitter,['EditorDavid'],red
1104,"Boston Biotech Conference Led To 245,000 COVID-19 Cases Across US","Saturday December 12, 2020 10:34AM",(cnn.com),43,Biotech,['BeauHD'],red
1105,Facebook Says Hackers Backed By Vietnam's Government Are Linked To IT Firm,"Saturday December 12, 2020 08:00AM",(arstechnica.com),11,Facebook,['BeauHD'],red
1106,The Zodiac Killer's Cipher Has Been Solved After 51 Years,"Saturday December 12, 2020 05:00AM",(cnn.com),78,Crime,['BeauHD'],red
1107,Is Warner Bros' Shift To Streaming New Movies 'A Great Danger'?,"Saturday December 12, 2020 01:30AM",(npr.org),93,Movies,['BeauHD'],red
1108,FDA Approves Pfizer/BioNTech Covid-19 Vaccine For Emergency Use in America,"Friday December 11, 2020 10:00PM",(theverge.com),222,United States,['EditorDavid'],red
1109,Florida Governor Defends Police Raid On COVID Data Whistleblower,"Friday December 11, 2020 09:10PM",(yahoo.com),145,Crime,['BeauHD'],red
1110,Google Will Let You Limit the Alcohol and Gambling Ads You See,"Friday December 11, 2020 08:30PM",(gizmodo.com),31,Advertising,['BeauHD'],green
1111,"Norman Abramson, Pioneer Behind Wireless Networks, Dies At 88","Friday December 11, 2020 08:10PM",(nytimes.com),7,Networking,['BeauHD'],orange
1112,Key People Are Leaving Facebook and Torching the Company In Departure Notes,"Friday December 11, 2020 07:50PM",(buzzfeednews.com),104,Facebook,['BeauHD'],red
1113,Big Tech Firms To Face 6% Fines If Breach New EU Content Rules,"Friday December 11, 2020 07:10PM",(reuters.com),42,EU,['BeauHD'],red
1114,"How the Nature Conservancy, the World's Biggest Environmental Group, Became a Dealer of Meaningless Carbon Offsets","Friday December 11, 2020 06:30PM",Empty,53,Earth,['msmash'],red
1115,"Oracle Is Moving Its Headquarters From Silicon Valley To Austin, Texas","Friday December 11, 2020 05:50PM",(cnbc.com),111,Oracle,['BeauHD'],red
1116,Elon Musk On the Problem With Corporate America: 'Too Many MBAs',"Friday December 11, 2020 05:10PM",(cnbc.com),195,Businesses,['BeauHD'],red
1117,Harrison Ford Will Return in a Fifth 'Indiana Jones' Movie,"Friday December 11, 2020 04:30PM",(cnn.com),87,Sci-Fi,['msmash'],red
1118,Amazon Plans To Help 29 Million People Grow their Tech Skills With Free Cloud Computing Training by 2025,"Friday December 11, 2020 03:50PM",(aboutamazon.com),44,Education,['msmash'],red
1119,CERN is Making the Large Hadron Collider's Data More Accessible,"Friday December 11, 2020 03:10PM",(engadget.com),6,Science,['msmash'],red
1120,Lockdown Gardening in Britain Leads To Archaeological Discoveries,"Friday December 11, 2020 02:30PM",(nytimes.com),66,United Kingdom,['msmash'],red
1121,"Apple Starts Work on Its Own Cellular Modem, Chip Chief Says","Friday December 11, 2020 01:50PM",(bloomberg.com),51,Communications,['msmash'],red
1122,Slashdot Asks: Favorite Movies and TV Shows You Watched This Year?,"Friday December 11, 2020 01:05PM",Empty,128,Television,['msmash'],red
1123,Inside the Obsessive World of Miniature Arcade Machine Makers,"Friday December 11, 2020 12:32PM",(wired.co.uk),25,Games,['msmash'],red
1124,EU Member States Agree 55% Cut in Carbon Emissions by 2030,"Friday December 11, 2020 11:47AM",(theguardian.com),65,EU,['msmash'],red
1125,'Cyberpunk 2077' Finally Shows What DLSS Is Good For,"Friday December 11, 2020 11:05AM",(vice.com),69,AI,['msmash'],red
1126,CISA and FBI Warn of Rise in Ransomware Attacks Targeting K-12 Schools,"Friday December 11, 2020 10:25AM",(zdnet.com),13,Security,['msmash'],red
1127,Twitter App Code Indicates That Live Video Broadcasting App Periscope May Get Shut Down,"Friday December 11, 2020 10:01AM",(techcrunch.com),11,Twitter,['msmash'],red
1128,Hyundai Motor Buys 80% of Robotics Firm Boston Dynamics,"Friday December 11, 2020 09:06AM",(bloomberg.com),40,Businesses,['msmash'],red
1129,Microsoft Will Start Force Upgrading Windows 10 For Some Users,"Friday December 11, 2020 08:00AM",(theredmondcloud.com),232,Windows,['BeauHD'],red
1130,Spotify Resets Passwords After a Security Bug Exposed Users' Private Account Information,"Friday December 11, 2020 05:00AM",(techcrunch.com),19,Security,['BeauHD'],red
1131,Microsoft's Latest Windows 10 Test Builds Includes Promised x64 Arm Emulation,"Friday December 11, 2020 02:00AM",(zdnet.com),30,Emulation (Games),['BeauHD'],red
1132,'We Need a Broadband Internet Pricing Equivalent of Nutrition Labels',"Thursday December 10, 2020 10:30PM",(slate.com),94,The Internet,['BeauHD'],red
1133,Gmail Will Now Let You Edit Office Documents Directly From Email Attachments,"Thursday December 10, 2020 08:30PM",(theverge.com),28,Google,['BeauHD'],red
1134,Ahsoka Tano Standalone Star Wars Series Coming To Disney Plus,"Thursday December 10, 2020 07:50PM",(cnet.com),50,Star Wars Prequels,['BeauHD'],red
1135,Proposed US Law Could Slap Twitch Streamers With Felonies For Broadcasting Copyrighted Material,"Thursday December 10, 2020 07:10PM",(kotaku.com),208,Crime,['BeauHD'],red
1136,FDA Panel Recommends Approval of Pfizer's Covid Vaccine For Emergency Use,"Thursday December 10, 2020 06:30PM",(cnbc.com),152,Medicine,['BeauHD'],red
1137,Facebook Hit With Antitrust Probe For Tying Oculus Use To Facebook Accounts,"Thursday December 10, 2020 05:50PM",(techcrunch.com),29,Facebook,['BeauHD'],red
1138,Brave Browser-Maker Launches Privacy-Friendly News Reader,"Thursday December 10, 2020 05:38PM",(arstechnica.com),12,Privacy,['BeauHD'],red
1139,"MasterCard, VISA To Stop Processing Payments On Pornhub","Thursday December 10, 2020 05:10PM",(reuters.com),114,The Almighty Buck,['BeauHD'],red
1140,Salesforce Claims Its AI Can Spot Signs of Breast Cancer With 92% Accuracy,"Thursday December 10, 2020 04:30PM",(venturebeat.com),24,AI,['msmash'],red
1141,Apple Shifts Leadership of Self-Driving Car Unit To AI Chief,"Thursday December 10, 2020 03:50PM",(bloomberg.com),11,AI,['msmash'],red
1142,'This Is a Bad Time to Build a High-End Gaming PC',"Thursday December 10, 2020 03:10PM",(extremetech.com),177,Hardware,['msmash'],red
1143,"Microsoft Exposes Adrozek, Malware That Hijacks Chrome, Edge, and Firefox","Thursday December 10, 2020 02:30PM",(zdnet.com),17,Microsoft,['msmash'],red
1144,India Cabinet Approves Setting Up a 'Massive Network' of Public Wi-Fi Hotspots,"Thursday December 10, 2020 02:00PM",(techcrunch.com),16,Communications,['msmash'],red
1145,"FCC Orders Equipment Removed in Step Aimed at Huawei, ZTE","Thursday December 10, 2020 01:20PM",(bloomberg.com),56,Communications,['msmash'],red
1146,Original Jailbreak App Store Cydia Sues Apple for its Monopoly,"Thursday December 10, 2020 12:40PM",(vice.com),102,Iphone,['msmash'],red
1147,"Weather Service Faces Internet Bandwidth Shortage, Proposes Limiting Key Data","Thursday December 10, 2020 11:50AM",(washingtonpost.com),67,IT,['msmash'],red
1148,"Google, Dell, and Intel Form New Computing Group for Transforming Cloud and IT Tools","Thursday December 10, 2020 11:00AM",(theverge.com),12,Google,['msmash'],red
1149,France Fines Google $120M and Amazon $42M For Dropping Tracking Cookies Without Consent,"Thursday December 10, 2020 10:20AM",(techcrunch.com),36,Google,['msmash'],red
1150,Cyberpunk 2077 Bugs Hit CD Projekt,"Thursday December 10, 2020 09:40AM",(bloomberg.com),148,Bug,['msmash'],red
1151,Wall Street Begins Trading Water Futures as a Commodity,"Thursday December 10, 2020 09:00AM",(yale.edu),183,Businesses,['msmash'],red
1152,"Hidden Symmetry Could Be Key To More Robust Quantum Systems, Researchers Find","Thursday December 10, 2020 08:00AM",(phys.org),14,Science,['BeauHD'],red
1153,Cruise Begins Driverless Testing In San Francisco,"Thursday December 10, 2020 05:00AM",(techcrunch.com),39,Transportation,['BeauHD'],red
1154,French Army Gets Ethical Go-Ahead For Bionic Soldiers,"Thursday December 10, 2020 02:00AM",(cnn.com),121,The Military,['BeauHD'],red
1155,Tesla Full Self-Driving System's Beta Developer Settings Leaked,"Wednesday December 09, 2020 10:30PM",(arstechnica.com),57,Transportation,['BeauHD'],red
1156,MDMA-Assisted Couples Therapy Investigated In Landmark Pilot Trial,"Wednesday December 09, 2020 09:10PM",Empty,68,Medicine,['BeauHD'],green
1157,SpaceX's Successful Starship High-Altitude Flight Ends In a Fiery Explosion,"Wednesday December 09, 2020 08:30PM",(engadget.com),285,Space,['BeauHD'],red
1158,Adobe Releases the Last Flash Update Ever,"Wednesday December 09, 2020 07:50PM",(theverge.com),57,Software,['BeauHD'],red
1159,UK Warns People With Serious Allergies To Avoid Pfizer Vaccine,"Wednesday December 09, 2020 07:10PM",(reuters.com),175,Medicine,['BeauHD'],red
1160,Google CEO Pledges To Investigate Exit of Top AI Ethicist,"Wednesday December 09, 2020 06:30PM",(axios.com),83,AI,['BeauHD'],red
1161,Hyundai To Acquire Boston Dynamics For Nearly $1 Billion,"Wednesday December 09, 2020 05:50PM",(therobotreport.com),20,Businesses,['BeauHD'],red
1162,"After Years of Fighting It, Nest Will Work With Samsung's SmartThings","Wednesday December 09, 2020 05:10PM",(arstechnica.com),20,Google,['BeauHD'],red
1163,EU Agency in Charge of COVID-19 Vaccine Approval Says it Was Hacked,"Wednesday December 09, 2020 04:30PM",(zdnet.com),40,Medicine,['msmash'],red
1164,How People Across the World Spend Their Time and What it Tells us About Living Conditions,"Wednesday December 09, 2020 03:50PM",(ourworldindata.org),45,Earth,['msmash'],red
1165,FTC Sues Facebook for Illegal Monopolization,"Wednesday December 09, 2020 03:10PM",(ftc.gov),122,Facebook,['msmash'],red
1166,Google Will Change How Chrome Extensions Access Data in 2021,"Wednesday December 09, 2020 02:31PM",(venturebeat.com),9,Chrome,['msmash'],red
1167,Apple Turned Blind Eye To Supplier Breaches of Chinese Labor Laws,"Wednesday December 09, 2020 01:52PM",(theinformation.com),51,Businesses,['msmash'],red
1168,YouTube Waits Until a Month After the Election To Act on False Claims of Election Fraud,"Wednesday December 09, 2020 01:08PM",(cnn.com),419,Youtube,['msmash'],red
1169,Human 'Stuff' Now Outweighs All Life on Earth,"Wednesday December 09, 2020 12:25PM",(sciencemag.org),98,Earth,['msmash'],red
1170,"2020 AP CS Scores: Still Big Gaps In Performance, Participation","Wednesday December 09, 2020 11:45AM",Empty,103,Programming,['msmash'],red
1171,"Microsoft, Unilever Join Amazon's Pledge To Fight Climate Change","Wednesday December 09, 2020 11:12AM",(bloomberg.com),28,Microsoft,['msmash'],red
1172,Xbox Cloud Gaming Coming To iOS and PC in Spring 2021,"Wednesday December 09, 2020 10:31AM",(techcrunch.com),20,XBox (Games),['msmash'],red
1173,Twitter Users Complain of Timelines Being Overrun With 'Promoted Tweets'; Twitter Says It's Intentional,"Wednesday December 09, 2020 09:50AM",(techcrunch.com),91,Twitter,['msmash'],red
1174,First Electric Air Taxis Set To Fly in Singapore by 2023,"Wednesday December 09, 2020 09:00AM",(bloomberg.com),28,Transportation,['msmash'],red
1175,"Germany, France, 11 Other EU Countries Team Up For Semiconductor Push","Wednesday December 09, 2020 08:00AM",(reuters.com),45,EU,['BeauHD'],red
1176,Samsung Plans To Ditch Power Adapters Just 3 Months After Mocking Apple Over the Same,"Wednesday December 09, 2020 05:00AM",(9to5mac.com),134,Power,['BeauHD'],red
1177,"Mount Everest, Earth's Tallest Mountain, Just Got Taller By About a Meter","Wednesday December 09, 2020 02:00AM",Empty,44,Earth,['BeauHD'],red
1178,Scientists Say They Have Come Up With a Potential Way To Make Oxygen On Mars,"Tuesday December 08, 2020 10:30PM",(cnn.com),122,Mars,['BeauHD'],red
1179,France To Build New Nuclear-Powered Aircraft Carrier,"Tuesday December 08, 2020 08:30PM",(apnews.com),244,The Military,['BeauHD'],red
1180,"Toyota Announces New All-Electric SUV, Says It's Their 'First Step' For Battery-Electric Cars","Tuesday December 08, 2020 07:50PM",(electrek.co),104,Transportation,['BeauHD'],red
1181,Cyberpunk 2077 Includes Visual Effects Designed To Trigger Epileptic Seizure,"Tuesday December 08, 2020 07:10PM",(gameinformer.com),171,Games,['BeauHD'],red
1182,Pornhub Ends Unverified Uploads and Bans Downloads,"Tuesday December 08, 2020 06:30PM",(engadget.com),123,Media,['BeauHD'],red
1183,"FireEye, a Top Cybersecurity Firm, Says It Was Hacked By a Nation-State","Tuesday December 08, 2020 05:50PM",(nytimes.com),51,Security,['BeauHD'],red
1184,Google Says It is Expanding Fuchsia's Open Source Model,"Tuesday December 08, 2020 05:11PM",(googleblog.com),79,Google,['msmash'],red
1185,"Chuck Yeager, Test Pilot Who Broke the Sound Barrier, Dies At 97","Tuesday December 08, 2020 04:30PM",(npr.org),48,The Military,['BeauHD'],red
1186,"GE Puts Default Password In Radiology Devices, Leaving Healthcare Networks Exposed","Tuesday December 08, 2020 03:50PM",Empty,40,Security,['BeauHD'],red
1187,CentOS 8 Ending Next Year To Focus Shift On CentOS Stream,"Tuesday December 08, 2020 03:10PM",(cyberciti.biz),136,Red Hat Software,['msmash'],red
1188,Senate Votes To Advance Nomination of Trump FCC Nominee,"Tuesday December 08, 2020 02:32PM",(reuters.com),94,Communications,['msmash'],red
1189,Google's Look To Speak Taps Gaze-Tracking AI To Help Users With Impairments Communicate,"Tuesday December 08, 2020 01:50PM",(venturebeat.com),11,AI,['msmash'],red
1190,"Amazon, Amex To Fund Software Developers in New GitHub Program","Tuesday December 08, 2020 01:10PM",(bloomberg.com),11,Programming,['msmash'],red
1191,Spam Calls Grew 18% This Year Despite the Global Pandemic,"Tuesday December 08, 2020 12:30PM",(techcrunch.com),89,Spam,['msmash'],red
1192,BTC-e Founder Sentenced To Five Years in Prison for Laundering Ransomware Funds,"Tuesday December 08, 2020 11:59AM",(zdnet.com),9,The Courts,['msmash'],red
1193,"Tripadvisor's App, and More Than 100 Others, Have Just Been Blocked in China","Tuesday December 08, 2020 11:11AM",(cnn.com),71,China,['msmash'],red
1194,Pfizer's Vaccine Offers Strong Protection After First Dose,"Tuesday December 08, 2020 10:31AM",(nytimes.com),190,Medicine,['msmash'],red
1195,Cloudflare and Apple Design a New Privacy-Friendly Internet Protocol,"Tuesday December 08, 2020 09:46AM",(techcrunch.com),90,The Internet,['msmash'],red
1196,Apple Launches $549 AirPods Max Over-Ear Headphones,"Tuesday December 08, 2020 09:03AM",(cnet.com),118,Apple,['msmash'],red
1197,"Coca-Cola, Pepsi and Nestle Named Top Plastic Polluters For Third Year In a Row","Tuesday December 08, 2020 08:00AM",(theguardian.com),158,Earth,['BeauHD'],red
1198,Did COVID Data Whistleblower Hack Florida's Emergency Alert System? Police Raid Home,"Tuesday December 08, 2020 05:00AM",(miamiherald.com),210,Security,['BeauHD'],red
1199,"Aliens In Hiding Until Mankind Is Ready, Says Ex-Israeli Space Head","Tuesday December 08, 2020 02:00AM",(nypost.com),332,Sci-Fi,['BeauHD'],red
1200,Electric-Car Companies Now Comprise Half the Worth of the World's 10 Most Valuable Automakers,"Mday December 07, 2020 10:30PM",(bloomberg.com),159,Transportation,['BeauHD'],red
1201,The World's First DNA 'Tricorder' In Your Pocket,"Mday December 07, 2020 09:10PM",(phys.org),54,Medicine,['BeauHD'],red
1202,LG Developing Sliding Doors Made of Transparent OLED Displays,"Mday December 07, 2020 08:30PM",(theverge.com),53,Displays,['BeauHD'],red
1203,Pornhub Might Lose Visa and Mastercard After NYT Expos,"Mday December 07, 2020 07:50PM",(gizmodo.com),157,The Almighty Buck,['BeauHD'],red
1204,IKEA Is Killing Off Its Catalog After 70 Years,"Mday December 07, 2020 07:30PM",(cnn.com),60,Books,['BeauHD'],orange
1205,"Hacker Opens 2,732 PickPoint Package Lockers Across Moscow","Mday December 07, 2020 07:10PM",(zdnet.com),31,Security,['BeauHD'],red
